3573, #3573, Green, Brave, Purple, Long, Angry, , McDonald's Hat, 
3574, #3574, Gray, Crescent, Green, Short, Relaxed, , Popcorn, Dominos Shirt
3575, #3575, Yellow, Tabby, Brown, Small, Discerning, , Burger King Hat, Burger King Uniform
3576, #3576, Purple, Sage, Black, Long, Open, , Dominos Hat, 
3577, #3577, Pink, Professor, Black, Small, Open, , McDonald's Box Hat, Dominos Shirt
3578, #3578, Pink, Crescent, White, Short, Open, , McDonald's Box Hat, 
3579, #3579, Yellow, Professor, Blue, Long, Relaxed, , , Starbucks Apron
3580, #3580, Green, Crescent, Brown, Small, Relaxed, , Subway Visor, Burger King Uniform
3581, #3581, Yellow, Crescent, White, Short, Relaxed, Eyepatch, Starbucks Hat, Starbucks Apron
3582, #3582, Blue, Crescent, Gray, Short, Discerning, , McDonald's Visor, Dominos Shirt
3583, #3583, Green, Tranquil, Brown, Long, Open, , , McDonalds Polo
3584, #3584, Blue, Tabby, Pink, Short, Adorable, , Pizza Hut Hat, McDonalds Shirt
3585, #3585, Gray, Tabby, Brown, Small, Rainbow, , Dunkin' Donuts Hat, 
3586, #3586, Green, Brave, Black, Short, Open, , , Janitor Shirt
3587, #3587, Green, Robot, Metal, Long, Open, , Hamburger, Dominos Shirt
3588, #3588, Purple, Professor, Red, Small, Open, , Burger King Hat, KFC Shirt
3589, #3589, Green, Crescent, Purple, Short, Open, , Burger King Hat, Janitor Shirt
3590, #3590, Purple, Crescent, Purple, Short, Angry, , Burger King Hat, McDonalds Polo
3591, #3591, Green, Crescent, Gray, Short, Open, , Dominos Hat, 
3592, #3592, Yellow, Stark, Gray, Short, Open, , Twin Peaks Hat, Taco Bell Shirt
3593, #3593, Yellow, Crescent, Gray, Small, Discerning, , Sushi, Burger King Uniform
3594, #3594, Green, Brave, Green, Short, Open, , Hooters Hat, KFC Shirt
3595, #3595, Pink, Stark, Green, Long, Rainbow, , , Walmart Shirt
3596, #3596, Yellow, Crescent, Red, Long, Relaxed, , Taco Bell Hat, 
3597, #3597, Green, Crescent, White, Small, Relaxed, , Popcorn, McDonalds Shirt
3598, #3598, Purple, Professor, Green, Short, Side-Eye, , Subway Visor 2, 
3599, #3599, Gray, Crescent, Gray, Small, Open, , Wendy's Hat, Janitor Shirt
3600, #3600, Gray, Stark, Pink, Small, Side-Eye, , Ben & Jerry's Bucket Hat, Burger King Uniform
3601, #3601, Blue, Professor, White, Small, Open, , , KFC Shirt
3602, #3602, Green, Sage, Gray, Small, Side-Eye, , , Janitor Shirt
3603, #3603, Pink, Professor, Purple, Small, Open, , Popcorn, Subway Shirt
3604, #3604, Yellow, Professor, Red, Short, Open, , Taco Bell Hat, 
3605, #3605, Gray, Tabby, Green, Short, Open, , Dunkin' Donuts Visor, Walmart Shirt
3606, #3606, Yellow, Crescent, Blue, Short, Open, , , Taco Bell Shirt
3607, #3607, Yellow, Tranquil, Pink, Small, Heart, , , Burger King Uniform
3608, #3608, Yellow, Skeleton, Bone, Long, Open, , Taco, 
3609, #3609, Purple, Crescent, Pink, Short, Side-Eye, , Starbucks Hat, Janitor Shirt
3610, #3610, Gray, Stark, White, Small, Open, , , McDonalds Polo
3611, #3611, Yellow, Tranquil, Red, Small, Side-Eye, , Subway Visor, Burger King Uniform
3612, #3612, Pink, Skeleton, Bone, Short, Angry, , Walmart Hat 2, 
3613, #3613, Gray, Sage, Gray, Short, Open, , Subway Visor, Burger King Uniform
3614, #3614, Green, Emperor, Brown, Short, Angry, , Twin Peaks Hat, McDonalds Polo
3615, #3615, Yellow, Professor, Green, Short, Relaxed, , Popcorn, Starbucks Apron
3616, #3616, Green, Stark, Gray, Small, Discerning, , Dunkin' Donuts Hat, Dominos Shirt
3617, #3617, Green, Crescent, Gray, Small, Relaxed, , Walmart Hat, 
3618, #3618, Green, Crescent, Green, Short, Open, , Ice Cream, Dominos Shirt
3619, #3619, Green, Guardian, Purple, Short, Fire, , Dunkin' Donuts Visor, McDonalds Polo
3620, #3620, Gray, Tranquil, White, Long, Open, , KFC Hat, 
3621, #3621, Green, Sage, Pink, Short, , Gazelles, Hamburger, Burger King Uniform
3622, #3622, Green, Brave, Black, Small, Discerning, , McDonald's Hat, Burger King Uniform
3623, #3623, Gray, Crescent, Black, Small, Relaxed, , , McDonalds Polo
3624, #3624, Gray, Crescent, Brown, Small, Open, , Burger King Visor, KFC Shirt
3625, #3625, Green, Stark, Brown, Short, Relaxed, , , McDonalds Shirt
3626, #3626, Yellow, Stark, Brown, Small, Moon, , McDonald's Hat, Dominos Shirt
3627, #3627, Green, Tranquil, Gray, Short, Heart, , McDonald's Visor, Taco Bell Shirt
3628, #3628, Gray, Crescent, Green, Long, Side-Eye, , Dunkin' Donuts Hat, Dominos Shirt
3629, #3629, Purple, Crescent, Purple, Short, Angry, , Burger King Hat, Burger King Uniform
3630, #3630, Gray, Crescent, Red, Small, Discerning, , Vintage McDonald's Hat, Walmart Shirt
3631, #3631, Pink, Tabby, Red, Small, Angry, , Burger King Hat, Burger King Uniform
3632, #3632, Purple, Crescent, Gray, Small, Angry, Monocle, Twin Peaks Hat, 
3633, #3633, Yellow, Sage, Green, Short, , Gazelles, Subway Visor, Dominos Shirt
3634, #3634, Green, Crescent, White, Small, , Jobs Glasses, Hamburger, McDonalds Polo
3635, #3635, Yellow, Crescent, Black, Small, Angry, , Taco Bell Hat, Dominos Shirt
3636, #3636, Green, Tabby, Black, Short, Angry, , , McDonalds Polo
3637, #3637, Pink, Tabby, Pink, Long, , Sunglasses, , Walmart Shirt
3638, #3638, Purple, Emperor, Purple, Short, Open, , , Walmart Shirt
3639, #3639, Pink, Stark, Green, Small, Moon, , McDonald's Bucket Hat, 
3640, #3640, Blue, Guardian, Gray, Short, , 3d Glasses, Dominos Hat, Starbucks Apron
3641, #3641, Green, Stark, Red, Long, Side-Eye, , , Dominos Shirt
3642, #3642, Gray, Tabby, Purple, Short, Angry, , Walmart Hat, KFC Shirt
3643, #3643, Green, Tranquil, White, Long, Open, , Sushi Headband, KFC Shirt
3644, #3644, Yellow, Brave, Gray, Short, , Jobs Glasses, Burger King Hat, 
3645, #3645, Green, Crescent, Pink, Long, Open, , Subway Visor, Janitor Shirt
3646, #3646, Pink, Crescent, Green, Long, Side-Eye, , McDonald's Bucket Hat, McDonalds Polo
3647, #3647, Yellow, Crescent, Gray, Small, Moon, , Taco, Janitor Shirt
3648, #3648, Blue, Crescent, Blue, Small, Diamond, , McDonald's Hat, KFC Shirt
3649, #3649, Blue, Tabby, Blue, Long, Relaxed, , Dunkin' Donuts Visor, McDonalds Shirt
3650, #3650, Yellow, Skeleton, Bone, Short, Open, , Walmart Hat, 
3651, #3651, Blue, Crescent, Green, Small, Side-Eye, , Hamburger, McDonalds Shirt
3652, #3652, Yellow, Crescent, Gray, Short, Heart, , , KFC Shirt
3653, #3653, Yellow, Tabby, White, Short, Open, Monocle, Vintage McDonald's Hat, Dominos Shirt
3654, #3654, Purple, Tranquil, Green, Long, Open, , Subway Visor, Burger King Uniform
3655, #3655, Blue, Tabby, White, Short, Moon, , Walmart Hat, McDonalds Polo
3656, #3656, Yellow, Tabby, Purple, Small, Angry, , Dunkin' Donuts Hat, McDonalds Polo
3657, #3657, Pink, Tabby, Pink, Small, Side-Eye, , Walmart Hat 2, McDonalds Polo
3658, #3658, Yellow, Stark, Purple, Small, Angry, , Taco Bell Hat, 
3659, #3659, Pink, Brave, Purple, Small, Angry, , Ice Cream, Taco Bell Shirt
3660, #3660, Purple, Crescent, Black, Small, Angry, , Burger King Hat, Burger King Uniform
3661, #3661, Yellow, Stark, Green, Short, Open, , McDonald's Box Hat, 
3662, #3662, Gray, Crescent, Black, Short, Open, , , Taco Bell Shirt
3663, #3663, Purple, Guardian, Gray, Small, Open, , , Starbucks Apron
3664, #3664, Yellow, Stark, Pink, Short, Side-Eye, , KFC Bucket Hat, 
3665, #3665, Green, Tabby, Pink, Long, Angry, , Burger King Hat, Burger King Uniform
3666, #3666, Purple, Crescent, Gray, Long, Angry, , Walmart Hat 2, Subway Shirt
3667, #3667, Yellow, Tabby, Brown, Short, Relaxed, , Starbucks Hat, Dominos Shirt
3668, #3668, Green, Guardian, Gray, Small, Discerning, , Pizza Hut Hat, 
3669, #3669, Green, Crescent, White, Small, Open, , Taco Bell Hat, McDonalds Shirt
3670, #3670, Purple, Crescent, Brown, Short, Discerning, , Twin Peaks Hat, 
3671, #3671, Green, Tranquil, Pink, Long, Discerning, , Burger King Crown, Burger King Uniform
3672, #3672, Blue, Crescent, Red, Small, Open, , Burger King Hat, Janitor Shirt
3673, #3673, Pink, Professor, Blue, Small, Open, Big Tech, Vintage McDonald's Hat, Burger King Uniform
3674, #3674, Green, Crescent, White, Long, , Rose-Colored Glasses, McDonald's Hat, Taco Bell Shirt
3675, #3675, Green, Golden, Legendary Sage, Long, Relaxed, , Popcorn, 
3676, #3676, Blue, Guardian, Purple, Small, Angry, , McDonald's Visor, Burger King Uniform
3677, #3677, Yellow, Tabby, Red, Long, Relaxed, , Dunkin' Donuts Hat, Ronald McDonald
3678, #3678, Purple, Tranquil, White, Short, Open, , Burger King Hat, McDonalds Shirt
3679, #3679, Purple, Emperor, Black, Small, Moon, , In-N-Out Burger Hat, Burger King Uniform
3680, #3680, Gray, Stark, Red, Long, Open, , Dunkin' Donuts Hat, McDonalds Shirt
3681, #3681, Purple, Guardian, Brown, Small, Angry, , Popcorn, Burger King Uniform
3682, #3682, Purple, Professor, Gray, Small, Side-Eye, , , Taco Bell Shirt
3683, #3683, Pink, Tranquil, Black, Small, Angry, , , McDonalds Polo
3684, #3684, Gray, Tabby, Gray, Long, , Visor, Dunkin' Donuts Visor, KFC Shirt
3685, #3685, Green, Tranquil, Brown, Small, Open, , McDonald's Hat, McDonalds Polo
3686, #3686, Gray, Crescent, Red, Small, Open, , McDonald's Visor, KFC Shirt
3687, #3687, Green, Professor, Gray, Small, Fire, , Hamburger, McDonalds Polo
3688, #3688, Pink, Crescent, White, Long, Discerning, , Burger King Visor, Dominos Shirt
3689, #3689, Yellow, Sage, Blue, Small, Relaxed, , Dunkin' Donuts Hat, Janitor Shirt
3690, #3690, Green, Guardian, Red, Long, Open, , KFC Bucket Hat, McDonalds Shirt
3691, #3691, Gray, Sage, Pink, Short, Discerning, , McDonald's Visor, McDonalds Polo
3692, #3692, Yellow, Stark, Pink, Long, Relaxed, , Subway Visor, Taco Bell Shirt
3693, #3693, Gray, Crescent, Brown, Small, Open, , , Taco Bell Shirt
3694, #3694, Pink, Tranquil, Purple, Small, Heart, , McDonald's Hat, 
3695, #3695, Green, Stark, Pink, Short, Relaxed, , Popcorn, Taco Bell Shirt
3696, #3696, Green, Guardian, Black, Short, Open, , McDonald's Hat, Subway Shirt
3697, #3697, Gray, Professor, Pink, Long, Side-Eye, , Dominos Hat, 
3698, #3698, Gray, Guardian, Red, Small, Open, , Ben & Jerry's Bucket Hat, Walmart Shirt
3699, #3699, Gray, Crescent, Green, Small, Angry, , Ice Cream, KFC Shirt
3700, #3700, Gray, Tranquil, Purple, Small, Angry, , Subway Visor, 
3701, #3701, Gray, Stark, Black, Small, Adorable, , Ice Cream Cone, Subway Shirt
3702, #3702, Pink, Tabby, Blue, Short, Moon, , McDonald's Hat, Burger King Uniform
3703, #3703, Pink, Stark, Green, Short, Discerning, , Walmart Hat 2, Starbucks Apron
3704, #3704, Blue, Crescent, Black, Short, Side-Eye, , In-N-Out Burger Hat, Burger King Uniform
3705, #3705, Green, Stark, Purple, Short, Angry, , Burger King Hat, Walmart Shirt
3706, #3706, Purple, Crescent, Red, Small, Open, , Wendy's Hat, McDonalds Polo
3707, #3707, Green, Crescent, Black, Short, Side-Eye, , Dunkin' Donuts Visor, 
3708, #3708, Purple, Guardian, Brown, Long, Relaxed, , Walmart Hat, McDonalds Shirt
3709, #3709, Yellow, Guardian, Purple, Long, Side-Eye, , Ben & Jerry's Bucket Hat, McDonalds Shirt
3710, #3710, Green, Crescent, White, Small, Side-Eye, , Taco, 
3711, #3711, Gray, Stark, Red, Long, Rainbow, , , McDonalds Shirt
3712, #3712, Yellow, Crescent, Gray, Small, Discerning, , Walmart Hat, Burger King Uniform
3713, #3713, Purple, Crescent, Red, Small, Discerning, , Denny's Hat, Dominos Shirt
3714, #3714, Green, Robot, Metal, Long, Open, , Wendy's Hat, Walmart Shirt
3715, #3715, Blue, Crescent, Green, Long, Relaxed, , Pizza Hut Hat, McDonalds Polo
3716, #3716, Pink, Crescent, Red, Small, Open, , McDonald's Hat, 
3717, #3717, Pink, Stark, Brown, Long, Relaxed, , Denny's Hat, Janitor Shirt
3718, #3718, Blue, Emperor, Pink, Short, Adorable, , Taco, Taco Bell Shirt
3719, #3719, Purple, Stark, Blue, Small, Heart, , , Janitor Shirt
3720, #3720, Green, Brave, Green, Short, Adorable, , Ben & Jerry's Bucket Hat, Starbucks Apron
3721, #3721, Green, Brave, Green, Long, Angry, , , McDonalds Shirt
3722, #3722, Pink, Stark, Brown, Short, Diamond, , Walmart Hat 2, McDonalds Shirt
3723, #3723, Green, Tabby, Pink, Short, Open, , McDonald's Visor, 
3724, #3724, Green, Tabby, Black, Long, Angry, , McDonald's Hat, Taco Bell Shirt
3725, #3725, Blue, Crescent, Red, Small, Open, , Walmart Hat 2, Subway Shirt
3726, #3726, Green, Brave, Brown, Long, Open, , Dominos Hat, Janitor Shirt
3727, #3727, Pink, Brave, Black, Short, Relaxed, , Denny's Hat, Janitor Shirt
3728, #3728, Blue, Brave, Gray, Short, Adorable, , Twin Peaks Hat, Dominos Shirt
3729, #3729, Blue, Guardian, Purple, Small, Open, , Hooters Hat, Walmart Shirt
3730, #3730, Blue, Brave, Gray, Long, Moon, , McDonald's Visor, Walmart Shirt
3731, #3731, Gray, Tranquil, Black, Small, Open, , , KFC Shirt
3732, #3732, Yellow, Tabby, Pink, Small, Discerning, , McDonald's Bucket Hat, Dominos Shirt
3733, #3733, Blue, Tranquil, Gray, Short, Open, , McDonald's Hat, Walmart Shirt
3734, #3734, Yellow, Stark, Blue, Short, Rainbow, , Starbucks Hat, Walmart Shirt
3735, #3735, Blue, Tabby, Purple, Long, Angry, , Subway Visor, Burger King Uniform
3736, #3736, Gray, Crescent, Purple, Long, , Black-rimmed Glasses, Walmart Hat 2, Dominos Shirt
3737, #3737, Gray, Tranquil, Blue, Small, Relaxed, , Burger King Visor, Dominos Shirt
3738, #3738, Gray, Tabby, Brown, Short, Angry, , Pizza Hut Hat, 
3739, #3739, Yellow, Crescent, Black, Small, Discerning, , , McDonalds Polo
3740, #3740, Green, Stark, Red, Small, Side-Eye, , McDonald's Bucket Hat, Walmart Shirt
3741, #3741, Green, Tranquil, Brown, Small, Open, , McDonald's Bucket Hat, Burger King Uniform
3742, #3742, Gray, Stark, Pink, Small, Discerning, , Pizza Hut Hat, McDonalds Shirt
3743, #3743, Blue, Emperor, Pink, Short, Angry, , Burger King Visor, Walmart Shirt
3744, #3744, Purple, Crescent, Gray, Small, Relaxed, , Walmart Hat 2, Dominos Shirt
3745, #3745, Green, Stark, Pink, Small, Discerning, , Walmart Hat 2, KFC Shirt
3746, #3746, Pink, Crescent, Gray, Small, Open, , , Taco Bell Shirt
3747, #3747, Green, Crescent, Blue, Short, Discerning, , McDonald's Visor, McDonalds Polo
3748, #3748, Green, Brave, Brown, Small, Open, , McDonald's Hat, Dominos Shirt
3749, #3749, Gray, Crescent, Red, Short, Open, , In-N-Out Burger Hat, McDonalds Shirt
3750, #3750, Pink, Crescent, Pink, Long, Open, , Starbucks Hat, Subway Shirt
3751, #3751, Green, Crescent, White, Short, Open, , McDonald's Bucket Hat, Janitor Shirt
3752, #3752, Gray, Crescent, White, Short, Open, , Ben & Jerry's Bucket Hat, McDonalds Polo
3753, #3753, Yellow, Crescent, Brown, Small, Adorable, , Pizza Hut Hat, McDonalds Polo
3754, #3754, Blue, Brave, White, Short, Open, , Hamburger, Subway Shirt
3755, #3755, Purple, Robot, Metal, Short, Open, , McDonald's Box Hat, KFC Shirt
3756, #3756, Pink, Sage, Blue, Short, Adorable, , Twin Peaks Hat, McDonalds Shirt
3757, #3757, Gray, Stark, Purple, Long, Angry, , McDonald's Bucket Hat, McDonalds Shirt
3758, #3758, Pink, Crescent, White, Small, Open, , Walmart Hat 2, McDonalds Polo
3759, #3759, Gray, Crescent, Red, Long, Side-Eye, , Popcorn, Burger King Uniform
3760, #3760, Purple, Tranquil, Red, Short, Open, , Dunkin' Donuts Hat, 
3761, #3761, Blue, Tranquil, Red, Small, Heart, , McDonald's Hat, Dominos Shirt
3762, #3762, Yellow, Crescent, Green, Small, Relaxed, , Denny's Hat, McDonalds Polo
3763, #3763, Blue, Crescent, Red, Long, Relaxed, , Burger King Hat, Taco Bell Shirt
3764, #3764, Green, Guardian, Green, Small, Relaxed, , Ben & Jerry's Bucket Hat, KFC Shirt
3765, #3765, Yellow, Stark, Pink, Small, Side-Eye, , Dunkin' Donuts Visor, McDonalds Shirt
3766, #3766, Yellow, Crescent, Green, Short, Open, , , Burger King Uniform
3767, #3767, Blue, Emperor, Green, Short, Discerning, , Walmart Hat, McDonalds Shirt
3768, #3768, Blue, Stark, Gray, Small, Discerning, , Twin Peaks Hat, McDonalds Polo
3769, #3769, Green, Tranquil, Blue, Long, Relaxed, , Sushi, Walmart Shirt
3770, #3770, Gray, Tranquil, Pink, Small, Open, , Hamburger, Burger King Uniform
3771, #3771, Green, Brave, Brown, Small, Open, , Burger King Hat, Burger King Uniform
3772, #3772, Pink, Stark, Blue, Short, Open, , Starbucks Hat, 
3773, #3773, Blue, Tabby, White, Short, Open, , Dunkin' Donuts Hat, Burger King Uniform
3774, #3774, Pink, Stark, Purple, Small, Discerning, , Hamburger, McDonalds Shirt
3775, #3775, Blue, Stark, Gray, Small, Open, , Popcorn, Burger King Uniform
3776, #3776, Blue, Crescent, Pink, Small, Relaxed, , McDonald's Bucket Hat, Taco Bell Shirt
3777, #3777, Blue, Brave, Pink, Small, Angry, , Burger King Hat, Burger King Uniform
3778, #3778, Purple, Tabby, Black, Long, Open, , Taco Bell Hat, McDonalds Shirt
3779, #3779, Purple, Crescent, White, Long, Open, , McDonald's Hat, 
3780, #3780, Green, Crescent, Red, Short, Angry, , McDonald's Hat, Subway Shirt
3781, #3781, Blue, Crescent, Red, Long, Rainbow, , , Dominos Shirt
3782, #3782, Gray, Crescent, Gray, Short, Moon, , Denny's Hat, Starbucks Apron
3783, #3783, Pink, Stark, Brown, Long, Side-Eye, , Burger King Visor, Walmart Shirt
3784, #3784, Green, Crescent, Pink, Short, Side-Eye, , , Janitor Shirt
3785, #3785, Pink, Tabby, Pink, Short, Open, , , Dominos Shirt
3786, #3786, Green, Robot, Metal, Small, Angry, , Wendy's Hat, McDonalds Shirt
3787, #3787, Purple, Crescent, White, Short, Angry, , Walmart Hat, Subway Shirt
3788, #3788, Yellow, Guardian, Purple, Small, Fire, , Chick-fil-A Hat, Ronald McDonald
3789, #3789, Green, Crescent, Purple, Small, Relaxed, , McDonald's Visor, 
3790, #3790, Gray, Crescent, Black, Short, Open, , KFC Hat, Burger King Uniform
3791, #3791, Pink, Crescent, Gray, Long, Open, , , Starbucks Apron
3792, #3792, Purple, Tranquil, Pink, Small, Discerning, , Popcorn, McDonalds Shirt
3793, #3793, Purple, Tranquil, Red, Short, Discerning, , Denny's Hat, Starbucks Apron
3794, #3794, Pink, Crescent, Pink, Short, Open, , KFC Bucket Hat, McDonalds Shirt
3795, #3795, Gray, Stark, Green, Small, Side-Eye, , , KFC Shirt
3796, #3796, Blue, Stark, White, Small, Open, , Burger King Hat, Burger King Uniform
3797, #3797, Yellow, Guardian, Pink, Small, Open, , McDonald's Box Hat, 
3798, #3798, Gray, Crescent, Purple, Short, Discerning, , Pizza Hut Hat, 
3799, #3799, Green, Guardian, Black, Small, Open, , Chick-fil-A Hat, KFC Shirt
3800, #3800, Green, Crescent, Green, Long, Angry, , Taco Bell Hat, Walmart Shirt
3801, #3801, Purple, Stark, Purple, Short, Adorable, , Chick-fil-A Hat, KFC Shirt
3802, #3802, Blue, Brave, Green, Short, Side-Eye, , , KFC Shirt
3803, #3803, Gray, Stark, Purple, Short, Angry, , KFC Bucket Hat, Janitor Shirt
3804, #3804, Pink, Tranquil, White, Long, Angry, , Walmart Hat, McDonalds Polo
3805, #3805, Gray, Tranquil, Green, Small, Heart, , Burger King Visor, McDonalds Polo
3806, #3806, Green, Tabby, Brown, Short, Side-Eye, , , Taco Bell Shirt
3807, #3807, Green, Stark, Purple, Short, Relaxed, , McDonald's Hat, Janitor Shirt
3808, #3808, Blue, Crescent, Black, Small, Discerning, , McDonald's Visor, 
3809, #3809, Green, Guardian, Green, Short, Angry, , , Burger King Uniform
3810, #3810, Blue, Crescent, Purple, Long, Discerning, , Ben & Jerry's Bucket Hat, McDonalds Shirt
3811, #3811, Green, Crescent, Red, Short, Angry, , Walmart Hat, 
3812, #3812, Yellow, Robot, Metal, Short, Open, , , Taco Bell Shirt
3813, #3813, Pink, Crescent, Pink, Small, Relaxed, , Burger King Hat, McDonalds Polo
3814, #3814, Yellow, Tabby, Brown, Small, Diamond, Monocle, Taco Bell Hat, Dominos Shirt
3815, #3815, Green, Crescent, Brown, Small, Rainbow, , Dominos Hat, 
3816, #3816, Yellow, Professor, Green, Small, Open, , , McDonalds Shirt
3817, #3817, Purple, Brave, Blue, Short, Relaxed, , Wendy's Hat, 
3818, #3818, Gray, Guardian, Pink, Long, Side-Eye, , , Subway Shirt
3819, #3819, Blue, Tranquil, Red, Small, , 3d Glasses, Taco Bell Hat, 
3820, #3820, Green, Tabby, Green, Long, Rainbow, Monocle, McDonald's Hat, Burger King Uniform
3821, #3821, Blue, Professor, Green, Small, Angry, , Dunkin' Donuts Hat, Dominos Shirt
3822, #3822, Gray, Crescent, Purple, Small, Relaxed, , Chick-fil-A Hat, Taco Bell Shirt
3823, #3823, Blue, Guardian, Pink, Small, Open, , Dominos Hat, 
3824, #3824, Gray, Crescent, Purple, Small, Open, , Denny's Hat, 
3825, #3825, Gray, Crescent, Purple, Short, Angry, , Taco Bell Hat, Janitor Shirt
3826, #3826, Yellow, Sage, Brown, Small, Open, , Pizza Hut Hat, Burger King Uniform
3827, #3827, Green, Stark, Green, Short, Open, , McDonald's Visor, 
3828, #3828, Gray, Stark, Pink, Small, , 3d Glasses, Chick-fil-A Hat, Walmart Shirt
3829, #3829, Gray, Guardian, Brown, Long, , Sunglasses, Walmart Hat, Dominos Shirt
3830, #3830, Blue, Tranquil, White, Long, Open, , Popcorn, Dominos Shirt
3831, #3831, Green, Crescent, Red, Small, Open, , , Walmart Shirt
3832, #3832, Blue, Crescent, White, Short, Discerning, , McDonald's Visor, Burger King Uniform
3833, #3833, Pink, Tabby, Green, Short, Relaxed, , Walmart Hat, Dominos Shirt
3834, #3834, Green, Emperor, Gray, Short, Relaxed, , Sushi, 
3835, #3835, Blue, Crescent, Black, Small, Discerning, , KFC Hat, 
3836, #3836, Purple, Guardian, Red, Small, Relaxed, , Walmart Hat 2, Starbucks Apron
3837, #3837, Blue, Brave, Blue, Small, Moon, , Walmart Hat 2, Subway Shirt
3838, #3838, Gray, Tabby, Blue, Small, Open, , Burger King Visor, Burger King Uniform
3839, #3839, Yellow, Crescent, Red, Small, , 3d Glasses, Dominos Hat, McDonalds Polo
3840, #3840, Yellow, Crescent, Pink, Short, Discerning, , Sushi, Walmart Shirt
3841, #3841, Yellow, Crescent, Blue, Small, Discerning, , Ben & Jerry's Bucket Hat, McDonalds Shirt
3842, #3842, Purple, Professor, Purple, Short, Side-Eye, , Pizza Hut Hat, 
3843, #3843, Purple, Tabby, Gray, Small, Open, , , Subway Shirt
3844, #3844, Green, Crescent, Green, Long, Open, , In-N-Out Burger Hat, Ronald McDonald
3845, #3845, Purple, Robot, Metal, Small, Open, , Burger King Hat, Dominos Shirt
3846, #3846, Green, Stark, Pink, Short, Moon, , Dunkin' Donuts Visor, Taco Bell Shirt
3847, #3847, Gray, Crescent, Purple, Small, Relaxed, , Dominos Hat, 
3848, #3848, Blue, Guardian, Red, Short, Open, , Burger King Hat, McDonalds Shirt
3849, #3849, Blue, Tabby, Brown, Small, Discerning, , Ben & Jerry's Bucket Hat, Dominos Shirt
3850, #3850, Purple, Tabby, Blue, Small, Relaxed, , Burger King Hat, Burger King Uniform
3851, #3851, Green, Crescent, Black, Small, Relaxed, , Popcorn, McDonalds Shirt
3852, #3852, Green, Brave, Red, Short, Open, , KFC Bucket Hat, McDonalds Polo
3853, #3853, Green, Crescent, Brown, Small, Diamond, , Starbucks Hat, McDonalds Shirt
3854, #3854, Gray, Stark, Brown, Small, Angry, , , Taco Bell Shirt
3855, #3855, Yellow, Tabby, Black, Small, Angry, , KFC Bucket Hat, McDonalds Shirt
3856, #3856, Green, Stark, Green, Short, Discerning, , Walmart Hat, Dominos Shirt
3857, #3857, Yellow, Professor, Blue, Small, Open, , , Burger King Uniform
3858, #3858, Blue, Guardian, Brown, Short, Open, , KFC Bucket Hat, Taco Bell Shirt
3859, #3859, Yellow, Guardian, Black, Short, Open, , Dominos Hat, 
3860, #3860, Gray, Tranquil, Green, Short, , Aviators, Wendy's Hat, Burger King Uniform
3861, #3861, Green, Stark, Black, Small, Relaxed, , McDonald's Visor, Dominos Shirt
3862, #3862, Gray, Crescent, Red, Short, Relaxed, , , Burger King Uniform
3863, #3863, Green, Brave, Green, Short, Angry, , , McDonalds Polo
3864, #3864, Pink, Crescent, Blue, Small, Relaxed, , Starbucks Hat, KFC Shirt
3865, #3865, Blue, Stark, White, Short, Adorable, , McDonald's Hat, 
3866, #3866, Yellow, Crescent, White, Short, Relaxed, , McDonald's Visor, Taco Bell Shirt
3867, #3867, Yellow, Brave, Brown, Long, Side-Eye, , McDonald's Visor, McDonalds Shirt
3868, #3868, Blue, Ruby Skeleton, Legendary Bone, Small, Relaxed, , McDonald's Visor, 
3869, #3869, Gray, Stark, Pink, Short, Open, , Dunkin' Donuts Visor, KFC Shirt
3870, #3870, Pink, Tranquil, Purple, Short, Discerning, , , Subway Shirt
3871, #3871, Pink, Emperor, Green, Small, Angry, , Denny's Hat, McDonalds Shirt
3872, #3872, Purple, Stark, Brown, Short, Heart, , McDonald's Box Hat, McDonalds Polo
3873, #3873, Purple, Crescent, Red, Short, Side-Eye, , Twin Peaks Hat, KFC Shirt
3874, #3874, Purple, Crescent, Brown, Short, Discerning, , Taco Bell Hat, Janitor Shirt
3875, #3875, Green, Brave, Gray, Long, Open, , Burger King Visor, Taco Bell Shirt
3876, #3876, Yellow, Crescent, Blue, Short, Open, , McDonald's Visor, 
3877, #3877, Green, Guardian, Red, Small, Open, , Pizza Hut Hat, Starbucks Apron
3878, #3878, Yellow, Guardian, Blue, Short, Open, , , McDonalds Polo
3879, #3879, Yellow, Tranquil, Pink, Small, Angry, , Sushi, Walmart Shirt
3880, #3880, Gray, Professor, White, Short, Discerning, , Wendy's Hat, McDonalds Polo
3881, #3881, Green, Robot, Metal, Small, Angry, , Hooters Hat, Subway Shirt
3882, #3882, Pink, Tranquil, Blue, Short, Open, , McDonald's Hat, Janitor Shirt
3883, #3883, Gray, Brave, Purple, Short, Open, , , McDonalds Shirt
3884, #3884, Green, Crescent, Purple, Small, Open, , Taco, 
3885, #3885, Yellow, Crescent, Purple, Short, Discerning, , , KFC Shirt
3886, #3886, Blue, Stark, Brown, Long, Discerning, , Dunkin' Donuts Visor, 
3887, #3887, Pink, Tabby, Gray, Small, Angry, , Burger King Hat, Walmart Shirt
3888, #3888, Yellow, Guardian, Blue, Small, Relaxed, , In-N-Out Burger Hat, Janitor Shirt
3889, #3889, Yellow, Stark, Green, Short, Open, , Walmart Hat, Ronald McDonald
3890, #3890, Blue, Crescent, Purple, Short, Angry, , Sushi, KFC Shirt
3891, #3891, Green, Emperor, Gray, Small, Side-Eye, , , McDonalds Polo
3892, #3892, Purple, Tabby, Black, Short, Open, , Pizza Hut Hat, Dominos Shirt
3893, #3893, Green, Tabby, Gray, Short, Angry, , McDonald's Visor, McDonalds Shirt
3894, #3894, Blue, Crescent, Purple, Small, Open, , In-N-Out Burger Hat, Subway Shirt
3895, #3895, Green, Crescent, Gray, Small, Side-Eye, , Hamburger, Taco Bell Shirt
3896, #3896, Green, Crescent, Purple, Short, Relaxed, , Twin Peaks Hat, Subway Shirt
