ID, Name, Background, Body, Feathers, Beak, Eyes, Eyewear, Headwear, Outfit
0, #0, Blue, Crescent, Black, Small, Rainbow, , Burger King Hat, McDonalds Shirt
1, #1, Yellow, Guardian, Black, Short, Discerning, , Chick-fil-A Hat, Walmart Shirt
2, #2, Gray, Stark, Gray, Short, Relaxed, , Walmart Hat, McDonalds Shirt
3, #3, Purple, Tranquil, Purple, Long, Open, , Walmart Hat 2, KFC Shirt
4, #4, Blue, Crescent, Black, Small, Angry, , In-N-Out Burger Hat, KFC Shirt
5, #5, Yellow, Stark, Blue, Short, Discerning, , Hooters Hat, Taco Bell Shirt
6, #6, Yellow, Crescent, Gray, Short, Fire, , Ice Cream Cone, 
7, #7, Purple, Tabby, Brown, Small, Open, , Walmart Hat 2, 
8, #8, Blue, Skeleton, Bone, Small, Discerning, , Denny's Hat, 
9, #9, Blue, Sage, Red, Small, Relaxed, , McDonald's Hat, Subway Shirt
10, #10, Pink, Crescent, Gray, Long, Open, , Burger King Hat, Starbucks Apron
11, #11, Yellow, Stark, Purple, Short, Open, , Popcorn, McDonalds Polo
12, #12, Gray, Tranquil, Purple, Small, Angry, , , KFC Shirt
13, #13, Blue, Professor, Pink, Short, Side-Eye, , , KFC Shirt
14, #14, Green, Crescent, Purple, Small, Relaxed, , Taco Bell Hat, Dominos Shirt
15, #15, Purple, Sage, Blue, Short, Relaxed, , Dunkin' Donuts Hat, 
16, #16, Yellow, Professor, Black, Short, Adorable, , Chick-fil-A Hat, Dominos Shirt
17, #17, Gray, Stark, Brown, Long, Open, , Walmart Hat, Burger King Uniform
18, #18, Pink, Brave, Gray, Small, Angry, , Walmart Hat 2, Burger King Uniform
19, #19, Green, Crescent, Gray, Short, Open, , Walmart Hat 2, 
20, #20, Yellow, Crescent, Black, Small, Open, , Ben & Jerry's Bucket Hat, Walmart Shirt
21, #21, Green, Stark, Blue, Small, Side-Eye, , Ben & Jerry's Bucket Hat, Subway Shirt
22, #22, Pink, Guardian, Green, Short, Relaxed, , , KFC Shirt
23, #23, Purple, Brave, Green, Short, Relaxed, , McDonald's Hat, Subway Shirt
24, #24, Gray, Crescent, Brown, Long, Side-Eye, , McDonald's Visor, Janitor Shirt
25, #25, Yellow, Crescent, Purple, Short, Discerning, , Taco, McDonalds Shirt
26, #26, Yellow, Guardian, Red, Small, Open, , McDonald's Bucket Hat, McDonalds Shirt
27, #27, Gray, Tranquil, Gray, Long, Relaxed, , Taco, Burger King Uniform
28, #28, Blue, Guardian, Brown, Small, Relaxed, , Ben & Jerry's Bucket Hat, McDonalds Shirt
29, #29, Yellow, Sage, Black, Small, Side-Eye, , Pizza Hut Hat, McDonalds Shirt
30, #30, Gray, Crescent, White, Short, Relaxed, , Subway Visor 2, McDonalds Shirt
31, #31, Purple, Brave, White, Small, Discerning, , Denny's Hat, Janitor Shirt
32, #32, Green, Guardian, Green, Short, Open, , In-N-Out Burger Hat, McDonalds Polo
33, #33, Gray, Tabby, Black, Small, Discerning, , , Janitor Shirt
34, #34, Yellow, Professor, Purple, Long, Rainbow, , Dominos Hat, Janitor Shirt
35, #35, Yellow, Crescent, Pink, Short, Relaxed, , McDonald's Hat, KFC Shirt
36, #36, Purple, Crescent, White, Short, Discerning, , Sushi, Taco Bell Shirt
37, #37, Green, Tabby, Red, Small, Side-Eye, , McDonald's Hat, Janitor Shirt
38, #38, Pink, Brave, Blue, Long, Open, , Subway Visor 2, Burger King Uniform
39, #39, Green, Crescent, White, Short, Relaxed, , Starbucks Hat, McDonalds Shirt
40, #40, Purple, Guardian, Green, Small, Diamond, , Ben & Jerry's Bucket Hat, KFC Shirt
41, #41, Green, Tranquil, Black, Small, Open, Big Tech, , Subway Shirt
42, #42, Blue, Stark, Black, Short, , Sunglasses, McDonald's Hat, Burger King Uniform
43, #43, Blue, Tranquil, Blue, Long, Open, , Sushi, 
44, #44, Green, Crescent, Brown, Short, Angry, , Dunkin' Donuts Hat, McDonalds Shirt
45, #45, Green, Crescent, Blue, Long, Open, , , KFC Shirt
46, #46, Pink, Professor, White, Short, Open, , Burger King Hat, Janitor Shirt
47, #47, Gray, Tabby, Green, Small, Open, , , Taco Bell Shirt
48, #48, Blue, Stark, Gray, Small, Side-Eye, , Burger King Hat, Dominos Shirt
49, #49, Gray, Stark, Purple, Small, Moon, , McDonald's Visor, Burger King Uniform
50, #50, Purple, Tranquil, Pink, Small, Diamond, , McDonald's Bucket Hat, Walmart Shirt
51, #51, Gray, Crescent, Purple, Short, Open, , McDonald's Visor, 
52, #52, Green, Tabby, Gray, Small, Relaxed, , Dunkin' Donuts Visor, McDonalds Polo
53, #53, Green, Tabby, Green, Short, Discerning, , Hooters Hat, Dominos Shirt
54, #54, Blue, Crescent, Green, Short, , Gazelles, Twin Peaks Hat, Walmart Shirt
55, #55, Gray, Crescent, Green, Small, Open, , , Taco Bell Shirt
56, #56, Gray, Crescent, Black, Short, Heart, , McDonald's Visor, Walmart Shirt
57, #57, Green, Robot, Metal, Short, Angry, , Hamburger, Janitor Shirt
58, #58, Yellow, Sage, Gray, Small, Adorable, , Hooters Hat, Subway Shirt
59, #59, Green, Crescent, Black, Long, Side-Eye, , McDonald's Hat, 
60, #60, Pink, Crescent, White, Small, Diamond, , Hamburger, 
61, #61, Pink, Ruby Skeleton, Legendary Bone, Small, Angry, , Denny's Hat, 
62, #62, Gray, Tabby, Brown, Short, , Gazelles, Walmart Hat, McDonalds Shirt
63, #63, Gray, Crescent, Red, Short, Open, , Chick-fil-A Hat, Subway Shirt
64, #64, Yellow, Brave, Green, Small, , 3d Glasses, McDonald's Visor, Subway Shirt
65, #65, Blue, Professor, Gray, Short, , Sunglasses, Taco, KFC Shirt
66, #66, Blue, Crescent, Gray, Small, Open, , Walmart Hat 2, Janitor Shirt
67, #67, Blue, Professor, White, Small, Open, , Walmart Hat, Janitor Shirt
68, #68, Green, Crescent, Blue, Small, Side-Eye, , Ben & Jerry's Bucket Hat, Burger King Uniform
69, #69, Blue, Golden, Legendary Crescent, Small, Open, , McDonald's Hat, McDonalds Shirt
70, #70, Blue, Tranquil, Black, Short, Discerning, , In-N-Out Burger Hat, Walmart Shirt
71, #71, Gray, Tabby, Red, Short, Angry, , Burger King Hat, Dominos Shirt
72, #72, Yellow, Crescent, Brown, Short, Open, , Hooters Hat, 
73, #73, Gray, Tabby, Gray, Small, Side-Eye, , Burger King Hat, Burger King Uniform
74, #74, Pink, Tabby, Black, Small, Adorable, , McDonald's Hat, 
75, #75, Green, Crescent, Blue, Long, Open, , McDonald's Visor, McDonalds Shirt
76, #76, Blue, Tabby, Brown, Short, , Gazelles, Walmart Hat, 
77, #77, Green, Crescent, White, Small, Angry, , Taco, 
78, #78, Gray, Tranquil, Red, Short, Angry, , Wendy's Hat, McDonalds Shirt
79, #79, Green, Crescent, Pink, Short, Relaxed, , Ice Cream, McDonalds Shirt
80, #80, Yellow, Sage, Black, Long, Open, , Popcorn, Walmart Shirt
81, #81, Green, Tranquil, Brown, Small, Side-Eye, , McDonald's Box Hat, McDonalds Polo
82, #82, Green, Tranquil, Red, Small, Open, , Popcorn, McDonalds Polo
83, #83, Yellow, Crescent, Black, Short, , Visor, Popcorn, Burger King Uniform
84, #84, Green, Crescent, Brown, Small, Angry, , In-N-Out Burger Hat, KFC Shirt
85, #85, Purple, Tranquil, White, Short, Discerning, , Ice Cream, McDonalds Shirt
86, #86, Green, Crescent, Pink, Short, Angry, , Vintage McDonald's Hat, McDonalds Shirt
87, #87, Blue, Crescent, Pink, Short, Open, , Taco, Dominos Shirt
88, #88, Pink, Crescent, Purple, Short, Side-Eye, , Walmart Hat 2, McDonalds Polo
89, #89, Green, Stark, Gray, Short, Discerning, , Dunkin' Donuts Visor, McDonalds Shirt
90, #90, Blue, Crescent, Blue, Short, Angry, , KFC Bucket Hat, 
91, #91, Green, Tranquil, Pink, Small, Side-Eye, , Burger King Visor, Dominos Shirt
92, #92, Gray, Tabby, Brown, Small, Fire, , KFC Bucket Hat, KFC Shirt
93, #93, Blue, Crescent, Gray, Small, Open, , Wendy's Hat, 
94, #94, Pink, Stark, Red, Short, Angry, , McDonald's Visor, 
95, #95, Yellow, Crescent, White, Short, Angry, , McDonald's Hat, Subway Shirt
96, #96, Green, Crescent, Gray, Small, Relaxed, , McDonald's Hat, 
97, #97, Yellow, Crescent, Black, Small, Open, , Dominos Hat, Burger King Uniform
98, #98, Green, Stark, Brown, Small, Heart, , Hooters Hat, McDonalds Shirt
99, #99, Blue, Tranquil, Purple, Small, Heart, , McDonald's Bucket Hat, 
100, #100, Purple, Tranquil, Green, Small, Open, , Denny's Hat, Starbucks Apron
101, #101, Green, Crescent, Gray, Small, Open, , Wendy's Hat, McDonalds Polo
102, #102, Gray, Stark, Gray, Short, Angry, , Pizza Hut Hat, 
103, #103, Yellow, Crescent, Brown, Small, Relaxed, , McDonald's Hat, 
104, #104, Green, Crescent, White, Long, Open, , , McDonalds Polo
105, #105, Gray, Stark, Red, Short, Discerning, , Walmart Hat, Taco Bell Shirt
106, #106, Gray, Crescent, Pink, Short, Angry, , Taco Bell Hat, KFC Shirt
107, #107, Yellow, Tranquil, Green, Small, Discerning, , McDonald's Hat, 
108, #108, Blue, Stark, Pink, Small, Discerning, , McDonald's Bucket Hat, Dominos Shirt
109, #109, Yellow, Crescent, Black, Small, Side-Eye, , McDonald's Bucket Hat, Janitor Shirt
110, #110, Blue, Skeleton, Bone, Long, Relaxed, , KFC Hat, 
111, #111, Purple, Tranquil, Blue, Short, Moon, , Taco, Janitor Shirt
112, #112, Blue, Professor, Black, Short, Side-Eye, , Popcorn, Burger King Uniform
113, #113, Gray, Crescent, Pink, Small, Relaxed, , Ben & Jerry's Bucket Hat, McDonalds Shirt
114, #114, Purple, Crescent, Pink, Small, Open, , Burger King Hat, Walmart Shirt
115, #115, Purple, Tranquil, Gray, Short, Open, , McDonald's Bucket Hat, Dominos Shirt
116, #116, Yellow, Professor, Gray, Small, Open, , Chick-fil-A Hat, 
117, #117, Green, Crescent, Gray, Small, Open, , Hamburger, Taco Bell Shirt
118, #118, Gray, Crescent, White, Short, Relaxed, , Denny's Hat, Starbucks Apron
119, #119, Gray, Tabby, Black, Small, Side-Eye, , Walmart Hat, Taco Bell Shirt
120, #120, Gray, Tabby, Blue, Short, , Sunglasses, KFC Hat, Burger King Uniform
121, #121, Yellow, Professor, Green, Small, Fire, , Sushi Headband, McDonalds Polo
122, #122, Green, Crescent, Purple, Long, Relaxed, , Hooters Hat, Janitor Shirt
123, #123, Pink, Stark, White, Short, Discerning, , McDonald's Visor, Subway Shirt
124, #124, Pink, Crescent, Brown, Small, Discerning, , In-N-Out Burger Hat, Burger King Uniform
125, #125, Pink, Guardian, Blue, Small, Relaxed, , Subway Visor, Janitor Shirt
126, #126, Pink, Stark, Purple, Small, Adorable, , Denny's Hat, Taco Bell Shirt
127, #127, Yellow, Brave, Purple, Short, Side-Eye, , McDonald's Box Hat, McDonalds Shirt
128, #128, Gray, Stark, White, Small, Angry, , Walmart Hat, 
129, #129, Green, Crescent, Gray, Small, Side-Eye, , Burger King Hat, McDonalds Shirt
130, #130, Gray, Guardian, Gray, Long, Open, , , Janitor Shirt
131, #131, Yellow, Crescent, Red, Small, Open, , Walmart Hat 2, Starbucks Apron
132, #132, Pink, Crescent, Red, Short, Open, , Sushi Headband, Taco Bell Shirt
133, #133, Green, Crescent, Black, Short, Side-Eye, , Chick-fil-A Hat, 
134, #134, Yellow, Stark, Brown, Small, Fire, , Ben & Jerry's Bucket Hat, KFC Shirt
135, #135, Pink, Tranquil, Green, Short, Relaxed, , Taco Bell Hat, Dominos Shirt
136, #136, Blue, Crescent, Red, Small, Discerning, , , Dominos Shirt
137, #137, Green, Sage, Purple, Short, Angry, , Dunkin' Donuts Hat, Starbucks Apron
138, #138, Green, Crescent, Pink, Long, Discerning, , Walmart Hat 2, Walmart Shirt
139, #139, Blue, Crescent, Green, Long, Open, , Walmart Hat, Burger King Uniform
140, #140, Gray, Crescent, Blue, Short, Relaxed, , In-N-Out Burger Hat, Subway Shirt
141, #141, Gray, Crescent, Red, Short, Relaxed, , Subway Visor 2, 
142, #142, Yellow, Crescent, Red, Short, Side-Eye, , In-N-Out Burger Hat, Burger King Uniform
143, #143, Blue, Crescent, Blue, Long, Discerning, , KFC Bucket Hat, Janitor Shirt
144, #144, Pink, Emperor, Pink, Short, Discerning, , Burger King Hat, Taco Bell Shirt
145, #145, Gray, Professor, Red, Small, Angry, , , McDonalds Polo
146, #146, Gray, Brave, Purple, Long, Relaxed, , McDonald's Bucket Hat, Burger King Uniform
147, #147, Green, Tabby, White, Small, Adorable, , Ben & Jerry's Bucket Hat, 
148, #148, Green, Tranquil, White, Short, Discerning, , KFC Hat, 
149, #149, Green, Emperor, Pink, Short, Open, , , KFC Shirt
150, #150, Pink, Professor, Blue, Small, Open, , , McDonalds Polo
151, #151, Blue, Stark, Red, Small, Angry, , Walmart Hat 2, Taco Bell Shirt
152, #152, Yellow, Crescent, White, Small, Angry, , Pizza Hut Hat, Subway Shirt
153, #153, Green, Crescent, Brown, Short, Angry, , KFC Hat, Burger King Uniform
154, #154, Purple, Crescent, Gray, Long, Open, , , KFC Shirt
155, #155, Pink, Sage, Pink, Small, Relaxed, , Walmart Hat, Dominos Shirt
156, #156, Pink, Tabby, Gray, Long, Angry, , McDonald's Hat, Dominos Shirt
157, #157, Green, Stark, Pink, Small, Relaxed, , Dunkin' Donuts Hat, McDonalds Polo
158, #158, Yellow, Tranquil, Red, Small, Open, , McDonald's Hat, McDonalds Polo
159, #159, Gray, Crescent, Green, Small, Side-Eye, , McDonald's Visor, Subway Shirt
160, #160, Green, Crescent, White, Short, Angry, , McDonald's Visor, 
161, #161, Green, Stark, Purple, Short, Discerning, , Starbucks Hat, Taco Bell Shirt
162, #162, Yellow, Crescent, Blue, Short, Open, , Denny's Hat, Dominos Shirt
163, #163, Green, Crescent, Gray, Short, Angry, , Burger King Hat, Taco Bell Shirt
164, #164, Blue, Emperor, Red, Small, Open, , KFC Hat, Burger King Uniform
165, #165, Green, Sage, Brown, Small, Side-Eye, , Walmart Hat, McDonalds Polo
166, #166, Blue, Crescent, Green, Small, Open, , Denny's Hat, McDonalds Polo
167, #167, Purple, Crescent, White, Short, Relaxed, , Sushi, Walmart Shirt
168, #168, Blue, Tabby, Black, Small, Open, , Dunkin' Donuts Hat, 
169, #169, Purple, Sage, Brown, Small, Fire, , McDonald's Bucket Hat, 
170, #170, Pink, Tranquil, White, Small, Side-Eye, , , Burger King Uniform
171, #171, Purple, Stark, Black, Short, Adorable, , Walmart Hat 2, Dominos Shirt
172, #172, Blue, Guardian, Green, Short, Relaxed, , McDonald's Hat, 
173, #173, Pink, Crescent, Pink, Small, Open, , Walmart Hat, McDonalds Shirt
174, #174, Green, Skeleton, Bone, Short, Discerning, , Twin Peaks Hat, 
175, #175, Yellow, Guardian, White, Long, Open, , KFC Hat, 
176, #176, Purple, Brave, Green, Small, Side-Eye, , Wendy's Hat, 
177, #177, Purple, Guardian, Gray, Short, Discerning, , McDonald's Box Hat, McDonalds Shirt
178, #178, Yellow, Crescent, Black, Short, Discerning, , Taco Bell Hat, Taco Bell Shirt
179, #179, Green, Tabby, White, Short, Side-Eye, , McDonald's Visor, KFC Shirt
180, #180, Green, Crescent, Blue, Short, Discerning, , Pizza Hut Hat, 
181, #181, Pink, Stark, Brown, Small, Open, , In-N-Out Burger Hat, McDonalds Polo
182, #182, Blue, Emperor, Purple, Small, Discerning, , Wendy's Hat, Janitor Shirt
183, #183, Pink, Crescent, Red, Small, Angry, , Twin Peaks Hat, Subway Shirt
184, #184, Blue, Stark, Purple, Short, Relaxed, , Dunkin' Donuts Visor, Burger King Uniform
185, #185, Yellow, Crescent, White, Small, Discerning, , Dunkin' Donuts Hat, Dominos Shirt
186, #186, Gray, Brave, Brown, Long, Open, , McDonald's Visor, Walmart Shirt
187, #187, Blue, Robot, Metal, Small, Open, , Pizza Hut Hat, Starbucks Apron
188, #188, Blue, Sage, Pink, Short, Relaxed, , Taco Bell Hat, Taco Bell Shirt
189, #189, Blue, Sage, Red, Short, Discerning, , Walmart Hat, 
190, #190, Purple, Stark, Red, Long, Angry, , KFC Bucket Hat, Burger King Uniform
191, #191, Gray, Crescent, White, Long, Relaxed, , Subway Visor 2, 
192, #192, Purple, Tabby, Brown, Short, Adorable, , McDonald's Box Hat, 
193, #193, Purple, Tranquil, Gray, Small, Angry, , Dominos Hat, McDonalds Shirt
194, #194, Gray, Tranquil, Black, Small, Side-Eye, , Walmart Hat, KFC Shirt
195, #195, Blue, Tabby, Pink, Long, Open, , In-N-Out Burger Hat, 
196, #196, Yellow, Crescent, Brown, Small, Side-Eye, , In-N-Out Burger Hat, Walmart Shirt
197, #197, Green, Tranquil, Gray, Small, Discerning, , KFC Hat, Subway Shirt
198, #198, Blue, Crescent, Blue, Small, Open, , Dominos Hat, Subway Shirt
199, #199, Green, Crescent, White, Long, Rainbow, , Hooters Hat, 
200, #200, Green, Crescent, Brown, Small, Open, , McDonald's Hat, McDonalds Shirt
201, #201, Green, Professor, Green, Short, Open, , Starbucks Hat, Taco Bell Shirt
202, #202, Gray, Crescent, Gray, Small, Heart, , Denny's Hat, Burger King Uniform
203, #203, Blue, Stark, Green, Long, Relaxed, , Burger King Visor, McDonalds Polo
204, #204, Blue, Stark, Purple, Long, Fire, , Chick-fil-A Hat, Taco Bell Shirt
205, #205, Gray, Brave, Blue, Long, Open, , Walmart Hat 2, Starbucks Apron
206, #206, Pink, Brave, Gray, Short, Open, , , Janitor Shirt
207, #207, Yellow, Crescent, Green, Long, Angry, , , McDonalds Shirt
208, #208, Green, Tranquil, Brown, Long, Side-Eye, , , Burger King Uniform
209, #209, Blue, Guardian, White, Small, Angry, , Twin Peaks Hat, Janitor Shirt
210, #210, Yellow, Guardian, Pink, Long, Open, , Dominos Hat, Burger King Uniform
211, #211, Green, Crescent, Pink, Small, Angry, , Walmart Hat, Janitor Shirt
212, #212, Blue, Stark, Brown, Small, Open, , Sushi, Taco Bell Shirt
213, #213, Green, Professor, Gray, Small, Angry, , , Walmart Shirt
214, #214, Purple, Guardian, Green, Small, Relaxed, , Ben & Jerry's Bucket Hat, Taco Bell Shirt
215, #215, Green, Brave, Red, Long, Moon, , Chick-fil-A Hat, 
216, #216, Purple, Stark, White, Short, , Sunglasses, , McDonalds Polo
217, #217, Blue, Stark, Black, Small, Angry, , , Burger King Uniform
218, #218, Yellow, Crescent, Green, Long, Angry, , Walmart Hat, KFC Shirt
219, #219, Gray, Crescent, Pink, Short, Open, , Subway Visor, Taco Bell Shirt
220, #220, Yellow, Crescent, Purple, Long, Fire, , McDonald's Hat, Taco Bell Shirt
221, #221, Purple, Tranquil, Gray, Long, Rainbow, , Twin Peaks Hat, 
222, #222, Green, Stark, Pink, Short, , Black-rimmed Glasses, McDonald's Hat, Burger King Uniform
223, #223, Green, Professor, Green, Short, Angry, , Dunkin' Donuts Visor, 
224, #224, Pink, Crescent, Black, Short, Fire, , , McDonalds Shirt
225, #225, Green, Tabby, White, Short, Side-Eye, , Subway Visor, KFC Shirt
226, #226, Blue, Robot, Metal, Short, Open, , , Ronald McDonald
227, #227, Blue, Guardian, Purple, Small, , Visor, Popcorn, Taco Bell Shirt
228, #228, Yellow, Crescent, Red, Small, Moon, , , McDonalds Polo
229, #229, Blue, Guardian, Blue, Long, Relaxed, , Hamburger, 
230, #230, Pink, Guardian, Red, Short, Open, , Ben & Jerry's Bucket Hat, Burger King Uniform
231, #231, Blue, Stark, White, Small, Open, , Dunkin' Donuts Hat, 
232, #232, Pink, Crescent, White, Short, Open, , , Taco Bell Shirt
233, #233, Purple, Crescent, Black, Small, Discerning, , Dunkin' Donuts Hat, Janitor Shirt
234, #234, Jade Green, Jade, Legendary Professor, , , , , McDonalds Polo
235, #235, Blue, Tranquil, Black, Short, Angry, , Burger King Hat, 
236, #236, Pink, Crescent, Purple, Short, Open, , Dominos Hat, Dominos Shirt
237, #237, Green, Brave, Purple, Small, Open, , Dominos Hat, Subway Shirt
238, #238, Yellow, Stark, Pink, Short, Open, , Twin Peaks Hat, 
239, #239, Green, Brave, Purple, Small, Relaxed, , Subway Visor 2, 
240, #240, Yellow, Tabby, Gray, Short, Relaxed, , McDonald's Hat, Subway Shirt
241, #241, Yellow, Brave, Pink, Long, Open, , Walmart Hat, Burger King Uniform
242, #242, Purple, Crescent, Brown, Short, , Gazelles, Twin Peaks Hat, Dominos Shirt
243, #243, Purple, Brave, Purple, Small, Adorable, , , McDonalds Polo
244, #244, Gray, Crescent, Black, Short, Discerning, , McDonald's Bucket Hat, Subway Shirt
245, #245, Blue, Brave, Red, Short, Discerning, , , Starbucks Apron
246, #246, Pink, Tranquil, Purple, Small, Discerning, , Starbucks Hat, 
247, #247, Gray, Emperor, Pink, Small, Open, , Taco Bell Hat, Burger King Uniform
248, #248, Pink, Crescent, Gray, Short, Relaxed, , Ice Cream Cone, 
249, #249, Gray, Crescent, Brown, Short, Open, , Burger King Visor, Janitor Shirt
250, #250, Purple, Stark, White, Short, Open, , , Taco Bell Shirt
251, #251, Pink, Crescent, Gray, Small, Side-Eye, , Starbucks Hat, McDonalds Shirt
252, #252, Green, Crescent, Red, Small, Side-Eye, , Walmart Hat, 
253, #253, Gray, Professor, Green, Short, Open, , McDonald's Bucket Hat, Burger King Uniform
254, #254, Yellow, Tabby, Black, Short, Adorable, , McDonald's Visor, Dominos Shirt
255, #255, Green, Stark, Red, Short, Open, Half-moon Spectacles, Dunkin' Donuts Hat, Janitor Shirt
256, #256, Gray, Tranquil, Red, Short, Discerning, Monocle, Burger King Visor, McDonalds Shirt
257, #257, Yellow, Brave, Gray, Short, Open, , McDonald's Box Hat, Taco Bell Shirt
258, #258, Green, Tabby, Purple, Small, Angry, , Burger King Hat, McDonalds Polo
259, #259, Yellow, Tranquil, Green, Short, Side-Eye, , Walmart Hat, 
260, #260, Purple, Tranquil, White, Short, Heart, , Dominos Hat, McDonalds Polo
261, #261, Pink, Crescent, Green, Short, Heart, , , Janitor Shirt
262, #262, Yellow, Tabby, Gray, Small, Open, , Twin Peaks Hat, Janitor Shirt
263, #263, Blue, Sage, Green, Short, Angry, , , McDonalds Polo
264, #264, Pink, Professor, Purple, Small, Side-Eye, , McDonald's Bucket Hat, McDonalds Shirt
265, #265, Gray, Guardian, White, Long, Relaxed, , , KFC Shirt
266, #266, Blue, Crescent, Red, Short, Discerning, , Burger King Hat, 
267, #267, Blue, Crescent, Blue, Short, Discerning, , Dunkin' Donuts Hat, 
268, #268, Pink, Professor, Brown, Long, Side-Eye, , Chick-fil-A Hat, McDonalds Shirt
269, #269, Yellow, Crescent, Purple, Long, Discerning, , Walmart Hat, KFC Shirt
270, #270, Blue, Crescent, Pink, Small, Relaxed, , McDonald's Visor, Taco Bell Shirt
271, #271, Blue, Guardian, Green, Small, Open, , Taco, Janitor Shirt
272, #272, Gray, Tabby, Red, Short, Angry, , Subway Visor, Dominos Shirt
273, #273, Yellow, Tabby, Pink, Short, Relaxed, , Chick-fil-A Hat, 
274, #274, Pink, Tranquil, Blue, Short, Open, , Dunkin' Donuts Hat, 
275, #275, Green, Stark, Gray, Small, Discerning, , Wendy's Hat, 
276, #276, Purple, Tabby, Green, Short, Open, , Denny's Hat, Janitor Shirt
277, #277, Yellow, Guardian, Green, Small, Open, , Burger King Visor, McDonalds Shirt
278, #278, Purple, Professor, White, Small, Open, , Burger King Visor, Subway Shirt
279, #279, Pink, Tabby, Gray, Short, Relaxed, , Ben & Jerry's Bucket Hat, 
280, #280, Pink, Skeleton, Bone, Small, Open, , In-N-Out Burger Hat, 
281, #281, Purple, Crescent, White, Long, Angry, , Pizza Hut Hat, McDonalds Shirt
282, #282, Pink, Tabby, White, Small, Relaxed, , Hooters Hat, Burger King Uniform
283, #283, Green, Stark, Pink, Small, Angry, , , Janitor Shirt
284, #284, Blue, Crescent, Brown, Long, Relaxed, , McDonald's Bucket Hat, Burger King Uniform
285, #285, Yellow, Crescent, Red, Short, , Sunglasses, Burger King Visor, 
286, #286, Purple, Tranquil, Gray, Small, Open, , Walmart Hat, 
287, #287, Green, Tabby, Brown, Short, Relaxed, , Dunkin' Donuts Hat, Burger King Uniform
288, #288, Purple, Crescent, Brown, Short, Discerning, , , KFC Shirt
289, #289, Gray, Crescent, White, Long, Diamond, , , KFC Shirt
290, #290, Purple, Crescent, Blue, Small, Side-Eye, , Twin Peaks Hat, Subway Shirt
291, #291, Blue, Crescent, Pink, Small, Open, , McDonald's Bucket Hat, Burger King Uniform
292, #292, Yellow, Guardian, Pink, Small, Side-Eye, , McDonald's Visor, 
293, #293, Pink, Crescent, Red, Small, Open, , Walmart Hat, Janitor Shirt
294, #294, Gray, Stark, Black, Small, Open, , , KFC Shirt
295, #295, Green, Guardian, Green, Small, Angry, , Popcorn, McDonalds Shirt
296, #296, Pink, Crescent, White, Short, Discerning, , McDonald's Box Hat, Taco Bell Shirt
297, #297, Purple, Crescent, Blue, Short, Discerning, , McDonald's Visor, 
298, #298, Gray, Tabby, White, Small, Discerning, , Ben & Jerry's Bucket Hat, Taco Bell Shirt
299, #299, Gray, Guardian, Black, Short, Angry, , Burger King Visor, McDonalds Polo
300, #300, Green, Professor, Black, Short, Discerning, , Denny's Hat, Burger King Uniform
301, #301, Yellow, Guardian, Black, Small, Open, , , Dominos Shirt
302, #302, Pink, Crescent, Green, Small, Relaxed, , Hooters Hat, KFC Shirt
303, #303, Green, Tranquil, Blue, Small, Discerning, , Starbucks Hat, Burger King Uniform
304, #304, Pink, Crescent, Brown, Small, Relaxed, , McDonald's Hat, Janitor Shirt
305, #305, Blue, Brave, Red, Short, Side-Eye, , , Subway Shirt
306, #306, Yellow, Guardian, Purple, Small, Relaxed, , Starbucks Hat, 
307, #307, Green, Stark, Red, Short, , Gazelles, Subway Visor 2, 
308, #308, Blue, Emperor, Green, Long, Fire, , McDonald's Hat, 
309, #309, Gray, Crescent, Purple, Small, , Jobs Glasses, Hamburger, 
310, #310, Blue, Crescent, Pink, Short, Open, , Dunkin' Donuts Hat, 
311, #311, Green, Crescent, Brown, Short, Open, , Chick-fil-A Hat, Walmart Shirt
312, #312, Green, Sage, Brown, Long, Side-Eye, , In-N-Out Burger Hat, Subway Shirt
313, #313, Purple, Crescent, Gray, Long, Open, Big Tech, Chick-fil-A Hat, McDonalds Polo
314, #314, Green, Crescent, Brown, Small, Angry, , Taco, 
315, #315, Pink, Brave, Pink, Long, Open, , KFC Bucket Hat, 
316, #316, Yellow, Tabby, Gray, Short, Open, , Taco Bell Hat, McDonalds Shirt
317, #317, Blue, Crescent, Green, Short, Discerning, , Subway Visor, Janitor Shirt
318, #318, Purple, Crescent, Blue, Short, Side-Eye, , Walmart Hat, Janitor Shirt
319, #319, Gray, Tranquil, Brown, Small, Open, , , Starbucks Apron
320, #320, Gray, Tabby, Blue, Small, Side-Eye, , KFC Hat, McDonalds Polo
321, #321, Green, Brave, Pink, Small, Side-Eye, , , Burger King Uniform
322, #322, Yellow, Tabby, Black, Short, Relaxed, , Popcorn, 
323, #323, Green, Stark, Green, Short, Angry, , In-N-Out Burger Hat, Starbucks Apron
324, #324, Green, Emperor, Red, Long, Relaxed, , Taco Bell Hat, McDonalds Shirt
325, #325, Gray, Guardian, Gray, Long, Side-Eye, , , Subway Shirt
326, #326, Gray, Stark, Brown, Small, Discerning, , Walmart Hat, 
327, #327, Gray, Crescent, Purple, Short, Open, , Chick-fil-A Hat, Dominos Shirt
328, #328, Green, Tabby, Gray, Short, Angry, , McDonald's Hat, McDonalds Shirt
329, #329, Purple, Crescent, Red, Small, Rainbow, , Dunkin' Donuts Hat, Dominos Shirt
330, #330, Pink, Stark, Blue, Small, Open, , , KFC Shirt
331, #331, Purple, Tabby, Purple, Short, Open, , Subway Visor, KFC Shirt
332, #332, Green, Crescent, White, Short, Open, , Walmart Hat, Janitor Shirt
333, #333, Purple, Tabby, Gray, Short, Angry, , Burger King Visor, Janitor Shirt
334, #334, Yellow, Brave, Pink, Short, Open, , Ben & Jerry's Bucket Hat, 
