2602, #2602, Blue, Stark, Gray, Short, Discerning, , Walmart Hat 2, McDonalds Polo
2603, #2603, Green, Crescent, White, Short, Angry, , Wendy's Hat, Walmart Shirt
2604, #2604, Blue, Guardian, Gray, Short, Heart, , , McDonalds Shirt
2605, #2605, Gray, Guardian, Purple, Short, Discerning, , Burger King Visor, Walmart Shirt
2606, #2606, Gray, Tabby, Black, Small, Open, , Chick-fil-A Hat, Dominos Shirt
2607, #2607, Pink, Tranquil, Gray, Small, Open, , Walmart Hat, 
2608, #2608, Green, Tranquil, Purple, Small, Discerning, , McDonald's Visor, 
2609, #2609, Gray, Guardian, Blue, Small, Discerning, , In-N-Out Burger Hat, 
2610, #2610, Pink, Crescent, Gray, Long, Open, , Denny's Hat, McDonalds Shirt
2611, #2611, Yellow, Emperor, Green, Short, Side-Eye, , Sushi, Taco Bell Shirt
2612, #2612, Blue, Tabby, White, Small, Rainbow, , KFC Bucket Hat, Burger King Uniform
2613, #2613, Yellow, Tranquil, Pink, Short, Open, , Dominos Hat, Taco Bell Shirt
2614, #2614, Purple, Crescent, Red, Long, Open, , Denny's Hat, Taco Bell Shirt
2615, #2615, Yellow, Tranquil, Green, Long, Open, , Hooters Hat, 
2616, #2616, Green, Professor, Green, Short, Relaxed, , , KFC Shirt
2617, #2617, Pink, Tranquil, Gray, Small, Side-Eye, , Twin Peaks Hat, Janitor Shirt
2618, #2618, Green, Stark, Red, Small, Angry, , , Burger King Uniform
2619, #2619, Blue, Stark, Gray, Short, Relaxed, , Chick-fil-A Hat, 
2620, #2620, Purple, Crescent, Red, Long, Discerning, , Sushi Headband, McDonalds Shirt
2621, #2621, Gray, Emperor, Blue, Small, Open, , Denny's Hat, Janitor Shirt
2622, #2622, Yellow, Tranquil, Pink, Small, Side-Eye, , Walmart Hat, Subway Shirt
2623, #2623, Blue, Emperor, Blue, Long, Relaxed, , Burger King Hat, Taco Bell Shirt
2624, #2624, Purple, Professor, Brown, Long, Side-Eye, , , Subway Shirt
2625, #2625, Pink, Guardian, Green, Short, Open, , , Taco Bell Shirt
2626, #2626, Purple, Stark, Brown, Short, Open, , Denny's Hat, 
2627, #2627, Blue, Crescent, Red, Short, Open, , McDonald's Bucket Hat, 
2628, #2628, Pink, Brave, Gray, Long, Open, , McDonald's Box Hat, Walmart Shirt
2629, #2629, Pink, Crescent, Red, Long, Discerning, , McDonald's Hat, Dominos Shirt
2630, #2630, Blue, Guardian, Gray, Small, Relaxed, , McDonald's Hat, Burger King Uniform
2631, #2631, Purple, Tranquil, Blue, Long, Adorable, , Sushi, KFC Shirt
2632, #2632, Green, Brave, Pink, Long, Open, , Walmart Hat, Dominos Shirt
2633, #2633, Purple, Stark, Gray, Small, Relaxed, , Ben & Jerry's Bucket Hat, Janitor Shirt
2634, #2634, Blue, Tabby, Green, Short, Angry, Monocle, , Taco Bell Shirt
2635, #2635, Yellow, Skeleton, Bone, Short, Relaxed, , Taco, 
2636, #2636, Blue, Emperor, Purple, Short, Open, , Hamburger, Dominos Shirt
2637, #2637, Purple, Professor, Blue, Short, Discerning, , Taco, Dominos Shirt
2638, #2638, Green, Guardian, Black, Short, Angry, , Denny's Hat, Janitor Shirt
2639, #2639, Gray, Crescent, Brown, Small, Open, , Denny's Hat, Starbucks Apron
2640, #2640, Purple, Tabby, Gray, Short, Angry, , McDonald's Visor, Janitor Shirt
2641, #2641, Pink, Crescent, White, Small, Angry, , Twin Peaks Hat, Burger King Uniform
2642, #2642, Purple, Skeleton, Bone, Short, Adorable, , McDonald's Bucket Hat, 
2643, #2643, Gray, Crescent, Red, Small, Discerning, , Ice Cream Cone, 
2644, #2644, Pink, Crescent, Pink, Small, , Jobs Glasses, Chick-fil-A Hat, 
2645, #2645, Green, Tranquil, Blue, Long, Discerning, , McDonald's Hat, Taco Bell Shirt
2646, #2646, Blue, Stark, Brown, Small, Diamond, , Subway Visor 2, Taco Bell Shirt
2647, #2647, Blue, Crescent, Pink, Short, Relaxed, , Popcorn, 
2648, #2648, Yellow, Crescent, Pink, Small, Angry, , Ben & Jerry's Bucket Hat, McDonalds Polo
2649, #2649, Yellow, Crescent, Black, Small, Moon, , Burger King Hat, 
2650, #2650, Yellow, Stark, Gray, Short, Discerning, , Chick-fil-A Hat, McDonalds Polo
2651, #2651, Blue, Tranquil, Red, Short, Diamond, , McDonald's Bucket Hat, Dominos Shirt
2652, #2652, Gray, Brave, Gray, Long, Discerning, , Starbucks Hat, Dominos Shirt
2653, #2653, Green, Tabby, Brown, Long, Open, , Walmart Hat 2, 
2654, #2654, Yellow, Sage, White, Small, Side-Eye, , , Janitor Shirt
2655, #2655, Gray, Tranquil, Green, Short, , Jobs Glasses, Walmart Hat, 
2656, #2656, Gray, Stark, Black, Short, Relaxed, , Walmart Hat 2, McDonalds Polo
2657, #2657, Green, Crescent, Blue, Short, Angry, , McDonald's Hat, 
2658, #2658, Green, Crescent, Red, Small, Discerning, , Walmart Hat, 
2659, #2659, Purple, Sage, White, Small, Angry, , Sushi, Janitor Shirt
2660, #2660, Green, Robot, Metal, Small, Open, , McDonald's Visor, KFC Shirt
2661, #2661, Blue, Crescent, Green, Short, Open, , Dunkin' Donuts Visor, Burger King Uniform
2662, #2662, Gray, Crescent, Blue, Short, Relaxed, , Ice Cream, 
2663, #2663, Pink, Crescent, Gray, Long, Open, , McDonald's Hat, Walmart Shirt
2664, #2664, Green, Skeleton, Bone, Small, Relaxed, , Twin Peaks Hat, 
2665, #2665, Gray, Stark, Gray, Long, , Black-rimmed Glasses, McDonald's Hat, McDonalds Shirt
2666, #2666, Yellow, Crescent, Blue, Long, Angry, , Pizza Hut Hat, Dominos Shirt
2667, #2667, Gray, Stark, Black, Small, Open, , , McDonalds Shirt
2668, #2668, Blue, Crescent, Red, Short, Moon, , McDonald's Hat, Subway Shirt
2669, #2669, Pink, Stark, Pink, Short, Open, , Starbucks Hat, McDonalds Polo
2670, #2670, Pink, Tabby, Red, Small, Open, , KFC Hat, Walmart Shirt
2671, #2671, Yellow, Crescent, Red, Short, Discerning, , Burger King Hat, Janitor Shirt
2672, #2672, Green, Professor, Blue, Short, Open, , McDonald's Visor, Subway Shirt
2673, #2673, Purple, Tranquil, Pink, Short, Open, , Taco Bell Hat, KFC Shirt
2674, #2674, Pink, Crescent, Purple, Short, Side-Eye, , Walmart Hat, McDonalds Polo
2675, #2675, Green, Tranquil, Blue, Short, Side-Eye, , Walmart Hat, Subway Shirt
2676, #2676, Blue, Crescent, Red, Long, Open, , Burger King Hat, Starbucks Apron
2677, #2677, Blue, Professor, Gray, Small, Open, , McDonald's Bucket Hat, KFC Shirt
2678, #2678, Purple, Crescent, White, Small, Relaxed, , McDonald's Hat, Starbucks Apron
2679, #2679, Green, Tranquil, Purple, Small, , Aviators, Chick-fil-A Hat, McDonalds Shirt
2680, #2680, Yellow, Crescent, Green, Small, Open, , , Taco Bell Shirt
2681, #2681, Blue, Crescent, Purple, Long, Open, , Subway Visor, McDonalds Polo
2682, #2682, Green, Crescent, Blue, Short, Discerning, , McDonald's Visor, Dominos Shirt
2683, #2683, Gray, Emperor, Purple, Short, Rainbow, , Sushi Headband, McDonalds Shirt
2684, #2684, Yellow, Sage, White, Small, Angry, , McDonald's Visor, 
2685, #2685, Yellow, Stark, Gray, Small, Angry, , Walmart Hat 2, Burger King Uniform
2686, #2686, Yellow, Stark, Pink, Small, Fire, , , McDonalds Shirt
2687, #2687, Gray, Crescent, Purple, Short, Discerning, , Subway Visor, Burger King Uniform
2688, #2688, Pink, Stark, Gray, Short, Relaxed, , Denny's Hat, 
2689, #2689, Yellow, Professor, Gray, Short, Discerning, , McDonald's Bucket Hat, Janitor Shirt
2690, #2690, Yellow, Crescent, White, Short, Open, , Walmart Hat, Starbucks Apron
2691, #2691, Green, Professor, Red, Small, Open, , Denny's Hat, Dominos Shirt
2692, #2692, Green, Crescent, Green, Small, Relaxed, , Ben & Jerry's Bucket Hat, 
2693, #2693, Blue, Robot, Metal, Long, Angry, , , Burger King Uniform
2694, #2694, Yellow, Crescent, Red, Small, Discerning, , , KFC Shirt
2695, #2695, Yellow, Guardian, Blue, Short, Angry, , , Starbucks Apron
2696, #2696, Gray, Professor, Green, Short, Angry, , McDonald's Hat, McDonalds Shirt
2697, #2697, Purple, Guardian, Gray, Small, Relaxed, , Burger King Hat, Starbucks Apron
2698, #2698, Blue, Guardian, Blue, Small, Side-Eye, , Wendy's Hat, Janitor Shirt
2699, #2699, Green, Robot, Metal, Small, Open, Big Tech, Starbucks Hat, 
2700, #2700, Yellow, Stark, Pink, Short, Side-Eye, , KFC Bucket Hat, Dominos Shirt
2701, #2701, Yellow, Crescent, Green, Short, Discerning, , Walmart Hat 2, 
2702, #2702, Green, Crescent, Green, Small, Relaxed, , , McDonalds Polo
2703, #2703, Green, Brave, Gray, Short, Moon, , KFC Hat, McDonalds Polo
2704, #2704, Purple, Tranquil, Green, Small, Relaxed, , Starbucks Hat, Burger King Uniform
2705, #2705, Blue, Tabby, Gray, Small, Open, , Dominos Hat, Ronald McDonald
2706, #2706, Blue, Sage, Brown, Long, Side-Eye, , Popcorn, 
2707, #2707, Green, Crescent, Red, Long, Angry, , McDonald's Visor, McDonalds Shirt
2708, #2708, Gray, Crescent, Green, Long, Side-Eye, , Burger King Hat, Subway Shirt
2709, #2709, Green, Crescent, Pink, Short, Moon, , , Burger King Uniform
2710, #2710, Purple, Skeleton, Bone, Small, Relaxed, , Subway Visor, 
2711, #2711, Purple, Tranquil, Brown, Short, Open, , , KFC Shirt
2712, #2712, Gray, Crescent, Purple, Short, Discerning, , In-N-Out Burger Hat, Burger King Uniform
2713, #2713, Yellow, Crescent, Green, Long, Relaxed, , , Subway Shirt
2714, #2714, Green, Stark, Red, Short, Heart, , Denny's Hat, Walmart Shirt
2715, #2715, Green, Professor, Green, Short, Open, , Popcorn, Taco Bell Shirt
2716, #2716, Blue, Tabby, Gray, Long, Open, , McDonald's Bucket Hat, Dominos Shirt
2717, #2717, Blue, Stark, Red, Long, Open, , McDonald's Hat, 
2718, #2718, Green, Tranquil, Pink, Short, Discerning, , Chick-fil-A Hat, Taco Bell Shirt
2719, #2719, Pink, Guardian, White, Small, Angry, , Dunkin' Donuts Hat, McDonalds Polo
2720, #2720, Green, Tranquil, Blue, Small, Discerning, , McDonald's Bucket Hat, McDonalds Polo
2721, #2721, Blue, Tabby, Blue, Short, Open, Half-moon Spectacles, Ice Cream, Starbucks Apron
2722, #2722, Green, Tabby, Blue, Small, , Black-rimmed Glasses, Burger King Hat, McDonalds Polo
2723, #2723, Pink, Crescent, Purple, Short, Discerning, , Burger King Hat, 
2724, #2724, Yellow, Stark, White, Small, Open, , Chick-fil-A Hat, Dominos Shirt
2725, #2725, Green, Guardian, Brown, Long, , Black-rimmed Glasses, Wendy's Hat, Burger King Uniform
2726, #2726, Yellow, Crescent, White, Short, Open, , Hooters Hat, Dominos Shirt
2727, #2727, Green, Professor, Pink, Small, Open, , Pizza Hut Hat, KFC Shirt
2728, #2728, Blue, Crescent, Pink, Small, Angry, , Dominos Hat, Starbucks Apron
2729, #2729, Yellow, Guardian, Green, Short, Angry, , McDonald's Visor, Burger King Uniform
2730, #2730, Green, Crescent, Green, Long, Discerning, , McDonald's Hat, McDonalds Shirt
2731, #2731, Blue, Tabby, Black, Short, Angry, , McDonald's Visor, 
2732, #2732, Pink, Tabby, Black, Small, Discerning, , Denny's Hat, Dominos Shirt
2733, #2733, Yellow, Stark, Purple, Long, Angry, , Taco Bell Hat, Burger King Uniform
2734, #2734, Gray, Crescent, Gray, Long, Open, , Taco, Walmart Shirt
2735, #2735, Blue, Crescent, Brown, Long, Angry, , Hamburger, Janitor Shirt
2736, #2736, Green, Skeleton, Bone, Short, Open, , Burger King Hat, 
2737, #2737, Pink, Stark, White, Short, Open, , Chick-fil-A Hat, Subway Shirt
2738, #2738, Green, Stark, Gray, Short, Relaxed, , , McDonalds Polo
2739, #2739, Green, Crescent, Red, Small, Angry, , , Walmart Shirt
2740, #2740, Gray, Tranquil, Purple, Short, Relaxed, Monocle, Walmart Hat 2, Janitor Shirt
2741, #2741, Purple, Crescent, Gray, Long, Angry, , McDonald's Visor, McDonalds Polo
2742, #2742, Green, Professor, Blue, Long, Relaxed, , , McDonalds Shirt
2743, #2743, Gray, Crescent, Black, Small, Angry, , McDonald's Visor, Taco Bell Shirt
2744, #2744, Purple, Stark, Purple, Short, Open, , KFC Hat, Burger King Uniform
2745, #2745, Gray, Tabby, Blue, Short, Discerning, , , Dominos Shirt
2746, #2746, Pink, Brave, Pink, Small, Open, , Walmart Hat, Subway Shirt
2747, #2747, Yellow, Stark, Gray, Small, Open, , McDonald's Visor, Subway Shirt
2748, #2748, Gray, Emperor, Gray, Short, Angry, , Walmart Hat, 
2749, #2749, Purple, Crescent, Black, Small, Relaxed, , Dominos Hat, McDonalds Shirt
2750, #2750, Gray, Crescent, Pink, Small, , Aviators, , Dominos Shirt
2751, #2751, Purple, Crescent, White, Short, Angry, , Twin Peaks Hat, McDonalds Polo
2752, #2752, Pink, Crescent, Green, Long, Heart, , Pizza Hut Hat, KFC Shirt
2753, #2753, Green, Crescent, Purple, Small, Open, , , McDonalds Shirt
2754, #2754, Green, Crescent, Pink, Long, Open, , Ben & Jerry's Bucket Hat, Burger King Uniform
2755, #2755, Purple, Tabby, Pink, Short, Relaxed, , Pizza Hut Hat, McDonalds Polo
2756, #2756, Gray, Crescent, Red, Small, Open, , McDonald's Bucket Hat, 
2757, #2757, Blue, Brave, Blue, Small, Open, , McDonald's Hat, Walmart Shirt
2758, #2758, Green, Tabby, Gray, Short, Side-Eye, , McDonald's Bucket Hat, McDonalds Polo
2759, #2759, Gray, Professor, Red, Small, Side-Eye, , In-N-Out Burger Hat, McDonalds Polo
2760, #2760, Yellow, Brave, Purple, Small, Side-Eye, , Subway Visor 2, 
2761, #2761, Pink, Guardian, Blue, Short, Angry, , , McDonalds Shirt
2762, #2762, Purple, Stark, White, Small, Relaxed, , Ben & Jerry's Bucket Hat, Burger King Uniform
2763, #2763, Pink, Brave, Red, Small, Relaxed, , Walmart Hat, Burger King Uniform
2764, #2764, Blue, Guardian, Purple, Small, Rainbow, , Sushi Headband, McDonalds Shirt
2765, #2765, Green, Robot, Metal, Short, Open, , , McDonalds Polo
2766, #2766, Yellow, Crescent, Gray, Small, , Gazelles, Chick-fil-A Hat, McDonalds Polo
2767, #2767, Gray, Tranquil, Brown, Small, Relaxed, , , Walmart Shirt
2768, #2768, Glitch Red, Glitch, Legendary Crescent, , , , Ice Cream, 
2769, #2769, Gray, Crescent, Red, Short, Angry, , Burger King Hat, Burger King Uniform
2770, #2770, Gray, Crescent, Red, Short, Side-Eye, , Ice Cream Cone, McDonalds Shirt
2771, #2771, Gray, Crescent, Pink, Short, Open, , , McDonalds Polo
2772, #2772, Gray, Stark, Black, Small, Angry, , Burger King Visor, Subway Shirt
2773, #2773, Green, Crescent, White, Short, Angry, , Wendy's Hat, Starbucks Apron
2774, #2774, Pink, Skeleton, Bone, Long, Relaxed, , Burger King Crown, 
2775, #2775, Gray, Stark, Pink, Long, Side-Eye, , Pizza Hut Hat, McDonalds Polo
2776, #2776, Green, Tranquil, Brown, Small, Discerning, , , Taco Bell Shirt
2777, #2777, Gray, Stark, Black, Short, Side-Eye, , , KFC Shirt
2778, #2778, Purple, Crescent, Blue, Small, Relaxed, , Walmart Hat 2, 
2779, #2779, Yellow, Crescent, Gray, Short, Angry, , Starbucks Hat, Starbucks Apron
2780, #2780, Pink, Professor, Pink, Short, Open, , , Dominos Shirt
2781, #2781, Blue, Tabby, White, Small, , Jobs Glasses, Pizza Hut Hat, Starbucks Apron
2782, #2782, Green, Crescent, Blue, Short, Angry, , McDonald's Visor, 
2783, #2783, Blue, Stark, Blue, Short, Open, , Starbucks Hat, 
2784, #2784, Green, Brave, Purple, Small, Relaxed, , Pizza Hut Hat, Walmart Shirt
2785, #2785, Yellow, Stark, Pink, Short, Angry, , , Walmart Shirt
2786, #2786, Yellow, Stark, Black, Small, , Jobs Glasses, McDonald's Visor, Taco Bell Shirt
2787, #2787, Blue, Crescent, Black, Small, Open, , Walmart Hat 2, McDonalds Shirt
2788, #2788, Purple, Tranquil, Green, Long, Open, , McDonald's Bucket Hat, Burger King Uniform
2789, #2789, Purple, Tabby, White, Short, Relaxed, , Dominos Hat, McDonalds Polo
2790, #2790, Pink, Stark, Purple, Small, Diamond, , , McDonalds Shirt
2791, #2791, Pink, Brave, Gray, Short, Relaxed, , KFC Bucket Hat, Dominos Shirt
2792, #2792, Pink, Crescent, Gray, Small, Discerning, , Starbucks Hat, Janitor Shirt
2793, #2793, Blue, Tabby, Purple, Small, Angry, , Taco Bell Hat, 
2794, #2794, Blue, Professor, Brown, Small, Rainbow, , Dunkin' Donuts Hat, Starbucks Apron
2795, #2795, Pink, Brave, Red, Short, Open, , , McDonalds Shirt
2796, #2796, Green, Emperor, Black, Small, Heart, , , McDonalds Polo
2797, #2797, Green, Tabby, White, Long, Moon, , Burger King Hat, McDonalds Shirt
2798, #2798, Yellow, Crescent, Red, Small, , Jobs Glasses, , McDonalds Shirt
2799, #2799, Yellow, Crescent, Black, Small, Heart, , In-N-Out Burger Hat, Taco Bell Shirt
2800, #2800, Green, Tranquil, Gray, Short, Moon, , McDonald's Hat, 
2801, #2801, Purple, Brave, Black, Small, Angry, , Dominos Hat, McDonalds Polo
2802, #2802, Purple, Crescent, Brown, Small, Side-Eye, , Burger King Hat, Starbucks Apron
2803, #2803, Gray, Tabby, Gray, Small, Open, , , Walmart Shirt
2804, #2804, Blue, Crescent, Green, Long, Fire, , McDonald's Hat, Burger King Uniform
2805, #2805, Pink, Guardian, Black, Small, Angry, , Ben & Jerry's Bucket Hat, Ronald McDonald
2806, #2806, Gray, Crescent, Pink, Small, Rainbow, , Denny's Hat, Taco Bell Shirt
2807, #2807, Purple, Professor, White, Short, Side-Eye, , Ben & Jerry's Bucket Hat, KFC Shirt
2808, #2808, Yellow, Tabby, Brown, Short, Heart, , KFC Bucket Hat, 
2809, #2809, Yellow, Tabby, Purple, Short, Open, , Ice Cream, Starbucks Apron
2810, #2810, Pink, Tabby, Brown, Short, Relaxed, , Wendy's Hat, 
2811, #2811, Purple, Tranquil, Red, Short, Side-Eye, , Ben & Jerry's Bucket Hat, Subway Shirt
2812, #2812, Yellow, Crescent, Red, Small, Side-Eye, , McDonald's Bucket Hat, Subway Shirt
2813, #2813, Purple, Tabby, Brown, Small, Open, , Dominos Hat, Burger King Uniform
2814, #2814, Green, Guardian, Brown, Small, , Gazelles, McDonald's Hat, Burger King Uniform
2815, #2815, Purple, Guardian, Green, Short, Angry, , Dunkin' Donuts Hat, 
2816, #2816, Green, Crescent, Green, Small, Side-Eye, , , Taco Bell Shirt
2817, #2817, Yellow, Stark, Purple, Short, Angry, , Wendy's Hat, Janitor Shirt
2818, #2818, Green, Guardian, Blue, Short, Open, , , Janitor Shirt
2819, #2819, Yellow, Crescent, Black, Short, Side-Eye, , Dunkin' Donuts Visor, Subway Shirt
2820, #2820, Green, Crescent, Pink, Small, Angry, , Burger King Hat, Janitor Shirt
2821, #2821, Green, Brave, Green, Short, Angry, , Taco, Dominos Shirt
2822, #2822, Gray, Crescent, Red, Small, Side-Eye, , Starbucks Hat, Dominos Shirt
2823, #2823, Purple, Tabby, Black, Small, Fire, , McDonald's Visor, Dominos Shirt
2824, #2824, Green, Tranquil, White, Short, Open, , Walmart Hat 2, McDonalds Polo
2825, #2825, Blue, Crescent, Purple, Long, Discerning, , Taco, 
2826, #2826, Gray, Professor, Purple, Short, Side-Eye, , Subway Visor 2, Burger King Uniform
2827, #2827, Purple, Guardian, Green, Small, Angry, , Subway Visor, Walmart Shirt
2828, #2828, Green, Crescent, Blue, Long, Discerning, , McDonald's Bucket Hat, KFC Shirt
2829, #2829, Gray, Professor, Black, Small, Angry, , McDonald's Bucket Hat, Burger King Uniform
2830, #2830, Purple, Brave, Green, Short, Discerning, , Denny's Hat, 
2831, #2831, Blue, Crescent, White, Long, Relaxed, , Walmart Hat, McDonalds Polo
2832, #2832, Gray, Crescent, White, Short, Open, , , Burger King Uniform
2833, #2833, Blue, Stark, Purple, Short, Open, , Twin Peaks Hat, 
2834, #2834, Blue, Tranquil, White, Short, Angry, , Ben & Jerry's Bucket Hat, McDonalds Shirt
2835, #2835, Pink, Tabby, White, Short, , Aviators, Dunkin' Donuts Visor, KFC Shirt
2836, #2836, Green, Professor, Purple, Long, Adorable, , Twin Peaks Hat, Taco Bell Shirt
2837, #2837, Green, Crescent, Green, Long, Side-Eye, , Burger King Crown, Dominos Shirt
2838, #2838, Pink, Tranquil, Red, Small, Open, Eyepatch, Burger King Visor, 
2839, #2839, Green, Crescent, Black, Long, Relaxed, , Taco, 
2840, #2840, Purple, Tabby, Blue, Short, Discerning, , Chick-fil-A Hat, Janitor Shirt
2841, #2841, Pink, Crescent, Purple, Short, Open, , Walmart Hat, Burger King Uniform
2842, #2842, Pink, Tabby, Blue, Small, Moon, , Popcorn, Dominos Shirt
2843, #2843, Green, Tabby, Black, Long, Open, , Wendy's Hat, Taco Bell Shirt
2844, #2844, Yellow, Crescent, Black, Long, Open, Half-moon Spectacles, McDonald's Visor, Taco Bell Shirt
2845, #2845, Gray, Crescent, Pink, Small, Relaxed, , , Starbucks Apron
2846, #2846, Pink, Stark, Brown, Small, , Visor, Pizza Hut Hat, Subway Shirt
2847, #2847, Gray, Guardian, Pink, Small, , Sunglasses, Starbucks Hat, Dominos Shirt
2848, #2848, Blue, Guardian, Gray, Small, Open, , Walmart Hat, KFC Shirt
2849, #2849, Green, Crescent, Black, Long, Rainbow, , , Burger King Uniform
2850, #2850, Green, Crescent, Purple, Long, Side-Eye, , McDonald's Bucket Hat, Dominos Shirt
2851, #2851, Gray, Stark, Pink, Short, Relaxed, , Burger King Hat, KFC Shirt
2852, #2852, Green, Crescent, Brown, Small, Discerning, , Dunkin' Donuts Visor, McDonalds Polo
2853, #2853, Yellow, Crescent, Brown, Short, Open, , Pizza Hut Hat, 
2854, #2854, Gray, Crescent, Purple, Short, Open, , Hamburger, 
2855, #2855, Green, Crescent, White, Short, Angry, , Walmart Hat, Burger King Uniform
2856, #2856, Purple, Guardian, Brown, Short, Open, , Walmart Hat 2, Starbucks Apron
2857, #2857, Pink, Tabby, Brown, Short, Open, , McDonald's Bucket Hat, Starbucks Apron
2858, #2858, Purple, Crescent, Gray, Small, Angry, , KFC Hat, McDonalds Shirt
2859, #2859, Green, Brave, Pink, Small, Open, , Popcorn, McDonalds Polo
2860, #2860, Gray, Crescent, Red, Small, , Gazelles, Dunkin' Donuts Visor, Janitor Shirt
2861, #2861, Pink, Tranquil, Pink, Short, Open, , KFC Hat, KFC Shirt
2862, #2862, Green, Stark, White, Small, Angry, , Subway Visor, Dominos Shirt
2863, #2863, Pink, Crescent, Red, Long, Open, , , KFC Shirt
2864, #2864, Gray, Crescent, Red, Short, Open, , Burger King Visor, 
2865, #2865, Pink, Robot, Metal, Small, Angry, , , McDonalds Shirt
2866, #2866, Yellow, Guardian, Purple, Short, Moon, , Burger King Visor, Janitor Shirt
2867, #2867, Green, Tabby, Brown, Short, Open, , Ice Cream Cone, 
2868, #2868, Green, Sage, Purple, Small, Adorable, , Walmart Hat, Subway Shirt
2869, #2869, Purple, Tabby, Green, Small, Relaxed, , Burger King Hat, Walmart Shirt
2870, #2870, Yellow, Guardian, Purple, Small, Relaxed, , Wendy's Hat, Subway Shirt
2871, #2871, Purple, Professor, Black, Long, Open, , Pizza Hut Hat, 
2872, #2872, Gray, Crescent, Red, Short, Side-Eye, , Walmart Hat, Starbucks Apron
2873, #2873, Green, Crescent, Brown, Small, Side-Eye, , Dunkin' Donuts Visor, Burger King Uniform
2874, #2874, Green, Crescent, Pink, Short, Open, , Burger King Hat, Dominos Shirt
2875, #2875, Gray, Professor, Black, Long, Side-Eye, , Wendy's Hat, KFC Shirt
2876, #2876, Pink, Tabby, Purple, Small, Angry, , Walmart Hat 2, Dominos Shirt
2877, #2877, Blue, Crescent, Pink, Small, Angry, , KFC Hat, McDonalds Polo
2878, #2878, Gray, Tabby, Red, Small, Relaxed, , McDonald's Hat, Walmart Shirt
2879, #2879, Purple, Sage, Brown, Short, Angry, , Taco Bell Hat, Walmart Shirt
2880, #2880, Pink, Crescent, Red, Short, Open, , Walmart Hat 2, Taco Bell Shirt
2881, #2881, Blue, Skeleton, Bone, Long, Discerning, , Dunkin' Donuts Visor, 
2882, #2882, Pink, Crescent, Red, Small, Open, , , Walmart Shirt
2883, #2883, Purple, Sage, Gray, Long, Open, , Dominos Hat, 
2884, #2884, Purple, Crescent, Gray, Small, Discerning, , , Janitor Shirt
2885, #2885, Blue, Tranquil, Purple, Small, , Visor, , Starbucks Apron
2886, #2886, Blue, Crescent, White, Small, Relaxed, , Dunkin' Donuts Visor, Starbucks Apron
2887, #2887, Purple, Crescent, Red, Long, Discerning, , McDonald's Visor, Burger King Uniform
2888, #2888, Yellow, Crescent, White, Short, Discerning, , Ben & Jerry's Bucket Hat, 
2889, #2889, Yellow, Crescent, Pink, Small, Angry, , Taco Bell Hat, Janitor Shirt
2890, #2890, Green, Professor, Green, Short, Discerning, , McDonald's Hat, Walmart Shirt
2891, #2891, Purple, Tranquil, Blue, Small, Open, , Walmart Hat, McDonalds Polo
2892, #2892, Purple, Crescent, Pink, Small, Relaxed, , McDonald's Bucket Hat, Dominos Shirt
2893, #2893, Pink, Stark, Black, Short, Angry, , , KFC Shirt
2894, #2894, Yellow, Tranquil, Pink, Small, Open, , Starbucks Hat, McDonalds Polo
2895, #2895, Gray, Guardian, Brown, Small, Open, , Dunkin' Donuts Hat, Walmart Shirt
2896, #2896, Blue, Crescent, Gray, Long, Discerning, , Hamburger, 
2897, #2897, Gray, Skeleton, Bone, Long, Angry, , Subway Visor 2, 
2898, #2898, Green, Golden, Legendary Brave, Small, Open, Half-moon Spectacles, Dominos Hat, Dominos Shirt
2899, #2899, Yellow, Crescent, Blue, Long, Relaxed, , , Janitor Shirt
2900, #2900, Purple, Professor, Pink, Small, Relaxed, , , Starbucks Apron
2901, #2901, Blue, Crescent, Pink, Short, Open, , , Burger King Uniform
2902, #2902, Purple, Professor, Red, Small, Fire, , Walmart Hat, KFC Shirt
2903, #2903, Purple, Professor, Green, Small, Open, , Subway Visor, Burger King Uniform
2904, #2904, Yellow, Stark, Gray, Short, Angry, , Starbucks Hat, McDonalds Shirt
2905, #2905, Green, Crescent, Black, Small, Adorable, , Burger King Hat, 
2906, #2906, Pink, Guardian, Gray, Short, Adorable, , Denny's Hat, 
2907, #2907, Green, Stark, Red, Small, Side-Eye, , McDonald's Visor, 
2908, #2908, Purple, Stark, Blue, Long, Relaxed, , , Burger King Uniform
2909, #2909, Pink, Crescent, Green, Small, Relaxed, , Ice Cream, Taco Bell Shirt
2910, #2910, Purple, Stark, Brown, Short, Moon, , Chick-fil-A Hat, McDonalds Shirt
2911, #2911, Green, Emperor, White, Short, Side-Eye, , Starbucks Hat, Subway Shirt
2912, #2912, Blue, Tranquil, Green, Small, Open, , Starbucks Hat, KFC Shirt
2913, #2913, Gray, Tranquil, Pink, Small, Angry, , Popcorn, 
2914, #2914, Green, Sage, Pink, Long, Rainbow, , Burger King Visor, McDonalds Polo
2915, #2915, Green, Stark, Brown, Small, Angry, , Burger King Hat, Dominos Shirt
2916, #2916, Yellow, Robot, Metal, Short, Open, , Burger King Hat, Burger King Uniform
2917, #2917, Purple, Tranquil, Green, Small, Rainbow, , , Dominos Shirt
2918, #2918, Yellow, Professor, Blue, Short, Angry, , McDonald's Visor, McDonalds Shirt
2919, #2919, Pink, Crescent, Red, Small, Relaxed, , In-N-Out Burger Hat, Janitor Shirt
2920, #2920, Green, Tabby, Brown, Long, Open, , McDonald's Box Hat, 
2921, #2921, Green, Crescent, Red, Long, Moon, , McDonald's Visor, Subway Shirt
2922, #2922, Pink, Emperor, Gray, Short, Side-Eye, , In-N-Out Burger Hat, 
2923, #2923, Blue, Stark, Gray, Long, Open, , Walmart Hat, Dominos Shirt
2924, #2924, Yellow, Sage, Gray, Small, Heart, , Burger King Visor, McDonalds Polo
2925, #2925, Green, Guardian, Green, Small, Relaxed, , Hamburger, Taco Bell Shirt
2926, #2926, Pink, Tabby, White, Small, Angry, , McDonald's Visor, KFC Shirt
